,Title,Year,Rated,Released,Runtime,Genre,Director,Writer,Actors,Plot,Language,Country,Awards,Poster,Ratings,Metascore,imdbRating,imdbVotes,imdbID,Type,DVD,BoxOffice,Production,Website,Response,totalSeasons
762,That's My Man,1947,Approved,1-Jun-47,99 min,"Drama, Romance, Sport",Frank Borzage,"Steve Fisher, Bradley King","Don Ameche, Catherine McLeod, Roscoe Karns","A poor young man is finally able to achieve his dream of running a horse at the track, but when he starts becoming successful, he begins to lose sight of what mattered to him before.",English,United States,Nothing,https://m.media-amazon.com/images/M/MV5BZjYzMDQ1NmItYjJjZC00YzM5LThjOTUtMWU2MTk5NWU3MGY1XkEyXkFqcGdeQXVyNDcxNDkxMjA@._V1_SX300.jpg,"[{'Source': 'Internet Movie Database', 'Value': '6.6/10'}]",64.01811594,6.6,35785.50713,tt0039022,movie,N/A," $40,071,397.78 ",N/A,N/A,True,
763,Magnificent Doll,1946,Passed,1-Nov-46,90 min,"Drama, History",Frank Borzage,Irving Stone,"Ginger Rogers, David Niven, Burgess Meredith","Dolly Payne Madison is the daughter of boardinghouse owners in Washington, DC who falls in love with Aaron Burr and James Madison.",English,United States,Nothing,https://m.media-amazon.com/images/M/MV5BMDg0OGYxY2EtNmY2Yy00YTFmLThhMjQtOTk5MWMwNjdjZjA4XkEyXkFqcGdeQXVyMzExODEzNDA@._V1_SX300.jpg,"[{'Source': 'Internet Movie Database', 'Value': '6.0/10'}]",64.01811594,6,35785.50713,tt0038715,movie,19-Aug-14," $40,071,397.78 ",N/A,N/A,True,
764,I've Always Loved You,1946,Approved,2-Dec-46,117 min,"Drama, Musical, Romance",Frank Borzage,Borden Chase,"Philip Dorn, Catherine McLeod, Bill Carter",A beautiful young concert pianist is torn between her attraction to her arrogant but brilliant maestro and her love for a farm boy she left back home.,English,United States,Nothing,https://m.media-amazon.com/images/M/MV5BMzk0MTUzZGYtOTZlMi00MjQ4LTllZGMtNDg5OWVlMTI0YzNlXkEyXkFqcGdeQXVyNTk1MTk0MDI@._V1_SX300.jpg,"[{'Source': 'Internet Movie Database', 'Value': '6.5/10'}]",64.01811594,6.5,35785.50713,tt0038629,movie,1-Oct-15," $40,071,397.78 ",N/A,N/A,True,
765,Moonrise Kingdom,2012,PG-13,29-Jun-12,94 min,"Comedy, Drama, Romance",Wes Anderson,"Wes Anderson, Roman Coppola","Jared Gilman, Kara Hayward, Bruce Willis","A pair of young lovers flee their New England town, which causes a local search party to fan out to find them.",English,United States,Nominated for 1 Oscar. 36 wins & 122 nominations total,https://m.media-amazon.com/images/M/MV5BMzllMWI1ZDQtMmFhNS00NzJkLThmMTMtNzFmMmMyYjU3ZGVjXkEyXkFqcGdeQXVyMDI2NDg0NQ@@._V1_SX300.jpg,"[{'Source': 'Internet Movie Database', 'Value': '7.8/10'}, {'Source': 'Rotten Tomatoes', 'Value': '93%'}, {'Source': 'Metacritic', 'Value': '84/100'}]",84,7.8,"35,786",tt1748122,movie,16-Oct-12,"$40,071,398 ",N/A,N/A,True,
766,Joueuse,2009,Unrated,1-Apr-11,101 min,Drama,Caroline Bottaro,"Caroline Bottaro, Bertina Henrichs","Sandrine Bonnaire, Kevin Kline, Francis Renaud",A chambermaid on Corsica is obsessed with chess after seeing a US expat play it lovingly with l'Américaine. She cleans his house and now also plays with him on Tuesdays.,"French, English","France, Germany",2 wins & 3 nominations,https://m.media-amazon.com/images/M/MV5BMjEzODg5NDM0N15BMl5BanBnXkFtZTcwMzY5NjkzNA@@._V1_SX300.jpg,"[{'Source': 'Internet Movie Database', 'Value': '6.9/10'}, {'Source': 'Rotten Tomatoes', 'Value': '71%'}, {'Source': 'Metacritic', 'Value': '70/100'}]",70,6.9,"35,786",tt1082009,movie,12-Jan-10,"$40,071,398 ",N/A,N/A,True,
767,Baton Rouge,1988,R,10-Oct-88,90 min,"Crime, Mystery, Romance",Rafael Moleón,"Agustín Díaz Yanes, Rafael Moleón","Victoria Abril, Carmen Maura, Antonio Banderas","Poor gigolo tries to frame his rich mature mistress, but gets tangled in his own wiles.",Spanish,Spain,3 wins & 6 nominations,https://m.media-amazon.com/images/M/MV5BYzAwNWJhOTktY2YzOC00ZTVmLTg2NDktMTJhMGE5MWM4MWIxXkEyXkFqcGdeQXVyMTA0MjU0Ng@@._V1_SX300.jpg,"[{'Source': 'Internet Movie Database', 'Value': '6.2/10'}]",64.01811594,6.2,35785.50713,tt0094822,movie,N/A," $40,071,397.78 ",N/A,N/A,True,
768,I'm All Right Jack,1959,Not Rated,7-Mar-60,105 min,Comedy,John Boulting,"Alan Hackney, Frank Harvey, John Boulting","Ian Carmichael, Terry-Thomas, Peter Sellers",A naive aristocrat in search of a career becomes caught up in the struggles between his profit-minded uncle and an aggressive labor union.,English,United Kingdom,3 wins & 1 nomination total,https://m.media-amazon.com/images/M/MV5BZDhlOGZkZDgtY2U1MS00NDcwLWFlYzctNmQ3NDQ5NjJjNGZmXkEyXkFqcGdeQXVyMjI4MjA5MzA@._V1_SX300.jpg,"[{'Source': 'Internet Movie Database', 'Value': '7.2/10'}, {'Source': 'Rotten Tomatoes', 'Value': '88%'}]",64.01811594,7.2,"35,786",tt0052911,movie,6-Nov-15," $40,071,397.78 ",N/A,N/A,True,
769,American Guinea Pig: The Song of Solomon,2017,R,5-May-18,86 min,Horror,Stephen Biro,Stephen Biro,"Jessica Cameron, Jim Van Bebber, Gene Palubicki",The Catholic Church is trying to save an innocent soul from the ravages of satanic possession. Wave after wave of holy men are sent to confront the possessed.,English,United States,Nothing,https://m.media-amazon.com/images/M/MV5BNWQyZGEyYWUtMzY4Zi00ZThiLWI4M2EtN2M3OWYwNzBlYTcwXkEyXkFqcGdeQXVyNDMyOTAzMjg@._V1_SX300.jpg,"[{'Source': 'Internet Movie Database', 'Value': '4.8/10'}]",64.01811594,4.8,35785.50713,tt6608032,movie,N/A," $40,071,397.78 ",N/A,N/A,True,
770,High Treason,1951,R,20-May-52,90 min,"Crime, Drama, Thriller",Roy Boulting,"Frank Harvey, Roy Boulting","Liam Redmond, André Morell, Kenneth Griffith","A wave of sabotage has been sweeping England, taking lives and creating instability. Cmdr. Robert Brennan and Supt. Folland of the Special Branch and Major Elliott of MI5 are charged with putting an end to this internal terrorism.",English,United Kingdom,Nothing,https://m.media-amazon.com/images/M/MV5BMWZmNzg5ZjYtMzRiNy00ZjRiLThkZmUtNjNjNmMwMWY1YjQzXkEyXkFqcGdeQXVyNDY3MzU2MDM@._V1_SX300.jpg,"[{'Source': 'Internet Movie Database', 'Value': '6.8/10'}]",64.01811594,6.8,35785.50713,tt0043637,movie,N/A," $40,071,397.78 ",N/A,N/A,True,
771,Run for the Sun,1956,Approved,30-Jul-56,99 min,"Adventure, Thriller",Roy Boulting,"Roy Boulting, Richard Connell, Dudley Nichols","Richard Widmark, Trevor Howard, Jane Greer","In Central America, an action-adventure novelist and a journalist for a magazine find themselves at the mercy of Nazi war criminals.","English, Spanish",United States,Nothing,https://m.media-amazon.com/images/M/MV5BZWZmODViNjktMjZjMS00YzUzLThmYWMtMjE5MTk5MDdmYjJiXkEyXkFqcGdeQXVyNTk1MTk0MDI@._V1_SX300.jpg,"[{'Source': 'Internet Movie Database', 'Value': '6.4/10'}]",64.01811594,6.4,"35,786",tt0049696,movie,8-May-12,"$40,071,398 ",Russ-Field Productions,N/A,True,
772,Heavens Above!,1963,Not Rated,23-May-63,105 min,Comedy,"John Boulting, Roy Boulting","Frank Harvey, John Boulting, Malcolm Muggeridge","Peter Sellers, Cecil Parker, Isabel Jeans",A minister is accidentally appointed to a snobbish parish.,"English, Hindi, French, Italian",United Kingdom,1 nomination total,https://m.media-amazon.com/images/M/MV5BMTczNTAzMDg5M15BMl5BanBnXkFtZTgwODE0MDkwMzE@._V1_SX300.jpg,"[{'Source': 'Internet Movie Database', 'Value': '6.8/10'}]",64.01811594,6.8,"35,786",tt0057134,movie,1-Oct-11," $40,071,397.78 ",N/A,N/A,True,
773,Touche pas à mon copain,1976,R,11-May-77,92 min,"Comedy, Western",Bernard Bouthier,Bernard Bouthier,"Claude Ventura, Christian Cucurullo, Jean-Louis Blenet",N/A,French,France,Nothing,https://m.media-amazon.com/images/M/MV5BOWFlYTlkNTItNzlkZS00OGU4LTlhOTEtYjAxM2Q4OWQxMGJiXkEyXkFqcGdeQXVyNzI4MDMyMTU@._V1_SX300.jpg,"[{'Source': 'Internet Movie Database', 'Value': '3.5/10'}]",64.01811594,3.5,35785.50713,tt0301943,movie,N/A," $40,071,397.78 ",N/A,N/A,True,
774,Circonstances atténuantes,1939,R,23-Sep-46,85 min,Comedy,Jean Boyer,"Marcel Arnac, Jean Boyer, Jean-Pierre Feydeau","Michel Simon, Suzanne Dantès, Dorville","A retired criminal-court judge on vacation finds himself stranded in a nest of thieves, who show him a friendlier side of crime.",French,France,Nothing,https://m.media-amazon.com/images/M/MV5BNmM2MGQ5MzAtMjczOC00MDY3LTg3YzItODFiOGFmYTYxOTI4L2ltYWdlXkEyXkFqcGdeQXVyNjM4NzIzNTE@._V1_SX300.jpg,"[{'Source': 'Internet Movie Database', 'Value': '7.0/10'}]",64.01811594,7,35785.50713,tt0031158,movie,N/A," $40,071,397.78 ",N/A,N/A,True,
775,Noix de coco,1939,R,17-Feb-39,80 min,"Comedy, Drama",Jean Boyer,Marcel Achard,"Raimu, Marie Bell, Michel Simon","A small town gentleman learns that his prim and proper wife was once a showgirl, and that, even worse, he had enjoyed a one night stand with her in the Orient.",French,"France, Germany",Nothing,https://m.media-amazon.com/images/M/MV5BNzk4MzIyNzQtMTY5ZC00YzgxLTk0MWYtMmM3YTljY2Q3MTk3XkEyXkFqcGdeQXVyMzg1ODEwNQ@@._V1_SX300.jpg,"[{'Source': 'Internet Movie Database', 'Value': '6.2/10'}]",64.01811594,6.2,35785.50713,tt0216040,movie,N/A," $40,071,397.78 ",N/A,N/A,True,
776,Chèque au porteur,1941,R,24-Dec-41,102 min,Comedy,Jean Boyer,Jean Boyer,"Lucien Baroux, Jean Tissier, Marguerite Pierry",N/A,French,France,Nothing,https://m.media-amazon.com/images/M/MV5BOTA1OTQ0YzEtODM0MS00NDE0LWEwMTQtODM4YmJhMjAyZmRlXkEyXkFqcGdeQXVyMDI3OTIzOA@@._V1_SX300.jpg,"[{'Source': 'Internet Movie Database', 'Value': '6.9/10'}]",64.01811594,6.9,35785.50713,tt0193819,movie,N/A," $40,071,397.78 ",N/A,N/A,True,
777,"À vos ordres, Madame",1942,R,16-Oct-42,91 min,Comedy,Jean Boyer,"André Birabeau, Jean Boyer, Yves Mirande","Jean Tissier, Suzanne Dehelly, Jacqueline Gauthier","Hector and Odette Dupuis' car breaks down in the middle of nowhere, but not far from a luxury hotel. The couple are well off but, being miserly, Odette is determined to keep her budget tight. Fortunately for her, the hotel offers roo",French,France,Nothing,https://m.media-amazon.com/images/M/MV5BMjY0NDYxZDUtMjU5MC00YmI4LWI0ZGMtYTAwODEwMDE4NjAzXkEyXkFqcGdeQXVyNjUzNzcwMjc@._V1_SX300.jpg,"[{'Source': 'Internet Movie Database', 'Value': '6.2/10'}]",64.01811594,6.2,35785.50713,tt0200315,movie,N/A," $40,071,397.78 ",N/A,N/A,True,
778,Nous irons à Paris,1950,R,10-Aug-50,93 min,Comedy,Jean Boyer,"Jean Boyer, André Hornez, Franz Tanzler","Ray Ventura, Philippe Lemaire, Françoise Arnoul","Three enterprising young men, Jacques Paul and Julien want to do radio. Refused by the official stations, they decided to create their own, called Radio X.",French,France,Nothing,https://m.media-amazon.com/images/M/MV5BYWVkYmY3NTAtNmEyYy00M2Q3LWE0NjMtNGVkMWI4ODNiN2MxXkEyXkFqcGdeQXVyMTYzNTE3NDA@._V1_SX300.jpg,"[{'Source': 'Internet Movie Database', 'Value': '7.1/10'}]",64.01811594,7.1,35785.50713,tt0041702,movie,N/A," $40,071,397.78 ",N/A,N/A,True,
779,Coiffeur pour dames,1952,Approved,1-Sep-54,87 min,Comedy,Jean Boyer,"Jean Boyer, Serge Veber, Paul Armont","Fernandel, Renée Devillers, Arlette Poirier","Mario (Fernandel), a bumptious sheep-shearer, discovers he has a inimtable touch that makes women, as well as sheep, swoon at his professional caress. He is soon the most sought-after hairdresser in France and is awarded the Legion o",French,France,Nothing,https://m.media-amazon.com/images/M/MV5BMTQyNzY1MDI5NF5BMl5BanBnXkFtZTcwNTI3NzY3MQ@@._V1_SX300.jpg,"[{'Source': 'Internet Movie Database', 'Value': '6.2/10'}]",64.01811594,6.2,35785.50713,tt0044504,movie,N/A," $40,071,397.78 ",N/A,N/A,True,
780,Femmes de Paris,1953,R,2-Dec-53,85 min,"Comedy, Musical, Mystery",Jean Boyer,"Alex Joffé, Ray Ventura, Jean Boyer","Michel Simon, Brigitte Auber, Henri Génès","It all begins when astronomer Charles spots a heretofore undiscovered exploding star while peering through is telescope. While calling his colleagues with the news, Charles inadvertently eavesdrops on a young girl, threatening suicid",French,France,Nothing,https://m.media-amazon.com/images/M/MV5BOGEyZjQ3MTktZDkwYS00OTZlLWE0MzItM2E0MzQ2ZDU0MjZmL2ltYWdlXkEyXkFqcGdeQXVyNjM4NzIzNTE@._V1_SX300.jpg,"[{'Source': 'Internet Movie Database', 'Value': '6.1/10'}]",64.01811594,6.1,35785.50713,tt0157626,movie,N/A," $40,071,397.78 ",N/A,N/A,True,
781,J'avais sept filles,1954,R,1-May-56,98 min,Comedy,Jean Boyer,"Jean Boyer, Aldo De Benedetti, Jean des Vallières","Maurice Chevalier, Delia Scala, Colette Ripert","An aging ladies man, with seven daughters out of wedlock to his credit, wants to stay young forever.",French,"France, Italy",Nothing,https://m.media-amazon.com/images/M/MV5BOWE1ODhhYTgtNzhjMy00MzE0LWE0OTctODdlMGU4NTRkNmQ0XkEyXkFqcGdeQXVyMTQ3Njg3MQ@@._V1_SX300.jpg,"[{'Source': 'Internet Movie Database', 'Value': '6.4/10'}]",64.01811594,6.4,35785.50713,tt0047125,movie,N/A," $40,071,397.78 ",N/A,N/A,True,
782,Sénéchal le magnifique,1957,R,24-May-57,95 min,Comedy,Jean Boyer,"Jean Boyer, Jean Manse, Jean-Jacques Rouff","Fernandel, Nadia Gray, Madeleine Barbulée","Sénéchal, an actor touring the provinces with the ""Tournées Carlini"" does not meet the success he thinks he deserves. One night in Dreux, he finds himself without his luggage and dressed up as a Foreign Legion officer, he is invited ",French,"France, Italy",Nothing,https://m.media-amazon.com/images/M/MV5BYWQ0MTcwMzctY2NmMy00NTcxLTk4YWUtYzZhOWI1NDNlYjc5L2ltYWdlL2ltYWdlXkEyXkFqcGdeQXVyNzAyMDM2MTQ@._V1_SX300.jpg,"[{'Source': 'Internet Movie Database', 'Value': '6.3/10'}]",64.01811594,6.3,35785.50713,tt0052264,movie,N/A," $40,071,397.78 ",N/A,N/A,True,
783,Bouche cousue,1960,R,27-Apr-60,N/A,N/A,Jean Boyer,"Jean Boyer, Jean-Pierre Feydeau, Serge Veber","Darry Cowl, Jacques Hilling, Sacha Pitoëff",N/A,French,France,Nothing,https://m.media-amazon.com/images/M/MV5BNmFiOGZiNGItMDQ4OC00YmNhLThkODAtZjhmODRiNmJhY2ZiXkEyXkFqcGdeQXVyMzg1ODEwNQ@@._V1_SX300.jpg,"[{'Source': 'Internet Movie Database', 'Value': '4.3/10'}]",64.01811594,4.3,35785.50713,tt0053670,movie,N/A," $40,071,397.78 ",N/A,N/A,True,
784,Relaxe-toi chérie,1964,R,19-Aug-64,85 min,Comedy,Jean Boyer,"Jean Bernard-Luc, Jean Boyer","Fernandel, Jean-Pierre Marielle, Jean Lefebvre",Hélène and François have been a perfect couple for twelve years. Hélène discovers psychoanalysis with Doctor Kougloff. She is convinced that her husband's apparent balance hides horrible tragedies.,French,"France, Italy",Nothing,https://m.media-amazon.com/images/M/MV5BODA5Yzk5ZDAtYTUxNS00NjI3LWFkYTMtMWRmZTI4MDcyY2I0XkEyXkFqcGdeQXVyMzg1ODEwNQ@@._V1_SX300.jpg,"[{'Source': 'Internet Movie Database', 'Value': '4.2/10'}]",64.01811594,4.2,35785.50713,tt0058517,movie,N/A," $40,071,397.78 ",N/A,N/A,True,
785,Shallow Grave,1994,R,10-Feb-95,89 min,"Crime, Thriller",Danny Boyle,John Hodge,"Kerry Fox, Christopher Eccleston, Ewan McGregor",Three friends discover their new flatmate dead but loaded with cash.,English,United Kingdom,14 wins & 1 nomination total,https://m.media-amazon.com/images/M/MV5BZmVmOWVlODYtOTQ0Yy00ODY1LTgwZjMtYWFhOWQ3ODhmYjliL2ltYWdlXkEyXkFqcGdeQXVyNjUwNzk3NDc@._V1_SX300.jpg,"[{'Source': 'Internet Movie Database', 'Value': '7.3/10'}, {'Source': 'Rotten Tomatoes', 'Value': '70%'}, {'Source': 'Metacritic', 'Value': '67/100'}]",67,7.3,"35,786",tt0111149,movie,12-Jun-12,"$40,071,398 ",N/A,N/A,True,
786,Steve Jobs,2015,R,23-Oct-15,122 min,"Biography, Drama",Danny Boyle,"Aaron Sorkin, Walter Isaacson","Michael Fassbender, Kate Winslet, Seth Rogen","Steve Jobs takes us behind the scenes of the digital revolution, to paint a portrait of the man at its epicenter. The story unfolds backstage at three iconic product launches, ending in 1998 with the unveiling of the iMac.",English,"United Kingdom, United States",Nominated for 2 Oscars. 28 wins & 114 nominations total,https://m.media-amazon.com/images/M/MV5BMjE0NTA2MTEwOV5BMl5BanBnXkFtZTgwNzg4NzU2NjE@._V1_SX300.jpg,"[{'Source': 'Internet Movie Database', 'Value': '7.2/10'}, {'Source': 'Rotten Tomatoes', 'Value': '85%'}, {'Source': 'Metacritic', 'Value': '82/100'}]",82,7.2,"35,786",tt2080374,movie,16-Feb-16,"$40,071,398 ",N/A,N/A,True,
787,Yesterday,2019,PG-13,28-Jun-19,116 min,"Comedy, Fantasy, Music",Danny Boyle,"Richard Curtis, Jack Barth","Himesh Patel, Lily James, Sophia Di Martino",A struggling musician realizes he's the only person on Earth who can remember The Beatles after waking up in an alternate timeline where they never existed.,"English, Portuguese, Japanese","United Kingdom, China, Japan, United States",1 win & 19 nominations,https://m.media-amazon.com/images/M/MV5BMjQ0NTI0NjkyN15BMl5BanBnXkFtZTgwNzY0MTE0NzM@._V1_SX300.jpg,"[{'Source': 'Internet Movie Database', 'Value': '6.8/10'}, {'Source': 'Rotten Tomatoes', 'Value': '63%'}, {'Source': 'Metacritic', 'Value': '55/100'}]",55,6.8,"35,786",tt8079248,movie,10-Sep-19,"$40,071,398 ",N/A,N/A,True,
788,New Morals for Old,1932,Passed,4-Jun-32,75 min,"Drama, Romance",Charles Brabin,"John Van Druten, Zelda Sears, Wanda Tuchock","Robert Young, Margaret Perry, Lewis Stone","A single mother struggles to raise her son and daughter,who find it difficult to listen to her life lessons.they forge their own lives,and make their own mistakes as a result.","English, French",United States,Nothing,https://m.media-amazon.com/images/M/MV5BYzExYWNiODQtMTc4OC00NmRkLWIzNDgtMmUyNWM5ZDFkYzU5XkEyXkFqcGdeQXVyMDUyOTUyNQ@@._V1_SX300.jpg,"[{'Source': 'Internet Movie Database', 'Value': '5.3/10'}]",64.01811594,5.3,35785.50713,tt0023262,movie,N/A," $40,071,397.78 ",Metro-Goldwyn-Mayer,N/A,True,
789,West of the Divide,1934,Approved,15-Feb-34,54 min,"Action, Adventure, Romance",Robert N. Bradbury,"Robert N. Bradbury, Oliver Drake","John Wayne, Virginia Brown Faire, George 'Gabby' Hayes",Ted Hayden impersonates a wanted man and joins Gentry's gang only to learn later that Gentry was the one who killed his father. He saves Virginia Winters' dad's ranch from Gentry and also rescues his long-lost brother Spud.,English,United States,Nothing,https://m.media-amazon.com/images/M/MV5BYmRjNWMxOWQtOGY2Yi00NjQ2LWFiZWQtYTRiNjUyZDRhOTYzL2ltYWdlL2ltYWdlXkEyXkFqcGdeQXVyNTEwNDcxNDc@._V1_SX300.jpg,"[{'Source': 'Internet Movie Database', 'Value': '5.3/10'}]",64.01811594,5.3,35785.50713,tt0025969,movie,12-Aug-03," $40,071,397.78 ",N/A,N/A,True,
790,Riders of Destiny,1933,Passed,10-Oct-33,53 min,"Music, Romance, Western",Robert N. Bradbury,Robert N. Bradbury,"John Wayne, Cecilia Parker, Forrest Taylor",Bad guy Kincaid controls the local water supply and plans to do in the other ranchers. Government agent Saunders shows up undercover to do in Kincaid and win the heart of one of his victims Fay Denton.,English,United States,Nothing,https://m.media-amazon.com/images/M/MV5BNzA0NTk1ZmItZTI3ZC00YTg5LTgxZjUtNjBlMGM4NjJjY2RjXkEyXkFqcGdeQXVyMTE2NzA0Ng@@._V1_SX300.jpg,"[{'Source': 'Internet Movie Database', 'Value': '5.5/10'}]",64.01811594,5.5,"35,786",tt0024500,movie,1-Mar-01," $40,071,397.78 ",Metro-Goldwyn-Mayer,N/A,True,
791,Texas Terror,1935,Approved,1-Feb-35,51 min,"Action, Adventure, Drama",Robert N. Bradbury,Robert N. Bradbury,"John Wayne, Lucile Browne, LeRoy Mason","Sheriff John Higgins quits and goes into prospecting after he thinks he has killed his best friend in shooting it out with robbers. He encounters his dead buddy's daughter, who has come from back east, and helps her run her ranch. Th",English,United States,Nothing,https://m.media-amazon.com/images/M/MV5BMjI2OTI1NjI1M15BMl5BanBnXkFtZTgwODkwODgwMzE@._V1_SX300.jpg,"[{'Source': 'Internet Movie Database', 'Value': '5.2/10'}]",64.01811594,5.2,35785.50713,tt0027087,movie,1-Jun-04," $40,071,397.78 ",N/A,N/A,True,
792,Blue Steel,1990,R,16-Mar-90,102 min,"Action, Crime, Drama",Kathryn Bigelow,"Kathryn Bigelow, Eric Red","Jamie Lee Curtis, Ron Silver, Clancy Brown",A rookie in the police force must engage in a cat-and-mouse game with a pistol-wielding psychopath who becomes obsessed with her.,English,United States,2 wins & 1 nomination,https://m.media-amazon.com/images/M/MV5BZDQ5MjgxNGQtZWM0ZC00ZGJkLWFhYWQtNzAxZTQwMDcyNTQxXkEyXkFqcGdeQXVyMTQxNzMzNDI@._V1_SX300.jpg,"[{'Source': 'Internet Movie Database', 'Value': '5.7/10'}, {'Source': 'Rotten Tomatoes', 'Value': '75%'}, {'Source': 'Metacritic', 'Value': '54/100'}]",54,5.7,"35,786",tt0099160,movie,3-Jan-17,"$40,071,398 ",N/A,N/A,True,
793,Westward Ho,1935,Approved,19-Aug-35,61 min,"Action, Drama, History",Robert N. Bradbury,"Robert Emmett Tansey, Lindsley Parsons","John Wayne, Sheila Bromley, Frank McGlynn Jr.",As a youngster John Wyatt saw his parents killed and his brother kidnapped. On a wagon train heading West he meets his brother who is now a spy for the gang which originally did the dirty work. He and his brother both fall for Mary G,English,United States,Nothing,https://m.media-amazon.com/images/M/MV5BMDA0ZjU4NTQtZmJkOS00MDJjLTgyMDgtZmRkNTdjN2FjODBjXkEyXkFqcGdeQXVyMDMxMjQwMw@@._V1_SX300.jpg,"[{'Source': 'Internet Movie Database', 'Value': '5.7/10'}]",64.01811594,5.7,35785.50713,tt0027200,movie,11-May-04," $40,071,397.78 ",N/A,N/A,True,
794,Alias John Law,1935,Passed,5-Nov-35,59 min,Western,Robert N. Bradbury,"Forbes Parkhill, Robert N. Bradbury","Bob Steele, Roberta Gale, Buck Connors","John Clark (Bob Steele) and his deaf pal, Bootch Collum (Buck Connors), are trailed by U. S. Marshal Lamar Bly (Jack Rockwell), who thinks they are part of The Kootney Kid's (Earl Dwire) gang, which had just held up the stage coach. ",English,United States,Nothing,https://m.media-amazon.com/images/M/MV5BZTU4ZWM0NTItZTc3ZS00OTAzLThiY2EtNGUyNTJhMGUwODgwXkEyXkFqcGdeQXVyMTY5Nzc4MDY@._V1_SX300.jpg,"[{'Source': 'Internet Movie Database', 'Value': '5.9/10'}]",64.01811594,5.9,35785.50713,tt0026052,movie,20-Jan-17," $40,071,397.78 ",N/A,N/A,True,
795,Last of the Warrens,1936,Passed,10-May-36,60 min,"Action, Romance, Western",Robert N. Bradbury,Robert N. Bradbury,"Bob Steele, Margaret Marquis, Charles King","Ted Warren returns from WW1 to find that everyone thinks he was dead. The culprit is Kent who intercepted his mail, rustled the Warren cattle, took over the Warren ranch, and is now after Ted's girl friend. When Kent's henchmen fail ",English,United States,Nothing,https://m.media-amazon.com/images/M/MV5BZmE3YzdlZDEtZTAxMi00M2QxLTg4OTMtMDRmN2U5ZDhkYzE4XkEyXkFqcGdeQXVyMTY5Nzc4MDY@._V1_SX300.jpg,"[{'Source': 'Internet Movie Database', 'Value': '6.2/10'}]",64.01811594,6.2,35785.50713,tt0027870,movie,30-Dec-16," $40,071,397.78 ",N/A,N/A,True,
796,Rakudai Kishi no Cavalry,2015,TV-MA,3-Oct-15,24 min,"Animation, Action, Fantasy",N/A,N/A,"Ryôta Ôsaka, Shizuka Ishigami, Bryson Baugus",Follow Ikki Kurogane as he defies the odds that everyone thinks he can't do. Ikki is the lowest of the low at his acdemy. While others have magical power and are high ranking. He is the only low ranker... a rank F. At each and every ,Japanese,Japan,Nothing,https://m.media-amazon.com/images/M/MV5BMzkwMDU4ODctZDUwZi00MDM3LWI4NTYtMWI1OTUxNzcxZjQzXkEyXkFqcGdeQXVyNTc3MDU1MTU@._V1_SX300.jpg,"[{'Source': 'Internet Movie Database', 'Value': '7.4/10'}]",64.01811594,7.4,"35,786",tt5100366,series,," $40,071,397.78 ",,,True,1
797,Trouble in Texas,1937,Passed,6-Mar-37,63 min,"Action, Adventure, Music",Robert N. Bradbury,"Robert Emmett Tansey, Lindsley Parsons","Tex Ritter, Rita Hayworth, White Flash","Rodeo stars are being killed with poisoned needles, and Tex Ritter is next on the list.",English,United States,Nothing,https://m.media-amazon.com/images/M/MV5BMDdjY2ZmNTktZDZmYi00OWNiLWJkYjktZjJjOWJmNDIzODA3XkEyXkFqcGdeQXVyMDMxMjQwMw@@._V1_SX300.jpg,"[{'Source': 'Internet Movie Database', 'Value': '5.4/10'}]",64.01811594,5.4,35785.50713,tt0029694,movie,27-Jul-04," $40,071,397.78 ",N/A,N/A,True,
798,Talk About a Stranger,1952,Passed,18-Apr-52,65 min,"Drama, Film-Noir, Mystery",David Bradley,"Margaret Fitts, Charlotte Armstrong","George Murphy, Nancy Reagan, Billy Gray","In an idyllic setting, a likable but dangerously volatile twelve-year-old boy tries to settle a score with his disagreeable, mysterious neighbor.",English,United States,Nothing,https://m.media-amazon.com/images/M/MV5BMWIwZjZlNzYtMWM0OC00NmFmLWJlMjAtNGFjMzJjOWMxYzgxXkEyXkFqcGdeQXVyNjYwODc3ODk@._V1_SX300.jpg,"[{'Source': 'Internet Movie Database', 'Value': '6.2/10'}]",64.01811594,6.2,35785.50713,tt0045216,movie,N/A," $40,071,397.78 ",N/A,N/A,True,
799,Garden State,2004,R,20-Aug-04,102 min,"Comedy, Drama, Romance",Zach Braff,Zach Braff,"Zach Braff, Peter Sarsgaard, Natalie Portman",A quietly troubled young man returns home for his mother's funeral after being estranged from his family for a decade.,"English, Klingon",United States,13 wins & 39 nominations,https://m.media-amazon.com/images/M/MV5BMjc5MDE0NjkxOF5BMl5BanBnXkFtZTcwNzA0NTkyMw@@._V1_SX300.jpg,"[{'Source': 'Internet Movie Database', 'Value': '7.4/10'}, {'Source': 'Rotten Tomatoes', 'Value': '86%'}, {'Source': 'Metacritic', 'Value': '67/100'}]",67,7.4,"35,786",tt0333766,movie,24-May-05,"$40,071,398 ",N/A,N/A,True,
800,Non ti pago!,1942,R,7-Oct-42,72 min,Comedy,Carlo Ludovico Bragaglia,"Carlo Ludovico Bragaglia, Eduardo De Filippo","Eduardo De Filippo, Peppino De Filippo, Titina De Filippo",N/A,Italian,Italy,Nothing,https://m.media-amazon.com/images/M/MV5BMTQ3ZDU3MDctMWY0NC00NmI1LWJkODItYTc4NTljNTczYjA5L2ltYWdlL2ltYWdlXkEyXkFqcGdeQXVyMTQ3Njg3MQ@@._V1_SX300.jpg,"[{'Source': 'Internet Movie Database', 'Value': '7.2/10'}]",64.01811594,7.2,35785.50713,tt0035131,movie,N/A," $40,071,397.78 ",N/A,N/A,True,
801,Totò cerca moglie,1950,R,3-Oct-51,76 min,Comedy,Carlo Ludovico Bragaglia,"Sandro Continenza, Agenore Incrocci, Vittorio Metz","Totò, Ave Ninchi, Marisa Merlini","Aunt Agatha writes to Toto, informing him that she won't send him another penny until he is married.",Italian,Italy,Nothing,https://m.media-amazon.com/images/M/MV5BZTQzMjI0NTgtYTNlNC00MzQxLWJhZTctZDhiNDEzNTFkMjljXkEyXkFqcGdeQXVyMjI4NzAzNjg@._V1_SX300.jpg,"[{'Source': 'Internet Movie Database', 'Value': '6.3/10'}]",64.01811594,6.3,35785.50713,tt0043058,movie,N/A," $40,071,397.78 ",N/A,N/A,True,
