,Title,Year,Rated,Released,Runtime,Genre,Director,Writer,Actors,Plot,Language,Country,Awards,Poster,Ratings,Metascore,imdbRating,imdbVotes,imdbID,Type,DVD,BoxOffice,Production,Website,Response,totalSeasons
227,Death Defying Acts,2007,PG,13-Mar-08,97 min,"Drama, History, Romance",Gillian Armstrong,"Tony Grisoni, Brian Ward","Catherine Zeta-Jones, Guy Pearce, Timothy Spall","On a tour of Britain in 1926, Harry Houdini (Guy Pearce) enters into a passionate affair with a psychic out to con him.","English, Hungarian","United Kingdom, Australia",5 wins & 7 nominations,https://m.media-amazon.com/images/M/MV5BMTI0MDA4MzM4MV5BMl5BanBnXkFtZTcwNjE3Nzc3MQ@@._V1_SX300.jpg,"[{'Source': 'Internet Movie Database', 'Value': '5.8/10'}, {'Source': 'Rotten Tomatoes', 'Value': '42%'}, {'Source': 'Metacritic', 'Value': '48/100'}]",48,5.8,"35,786",tt0472071,movie,28-Oct-08,"$40,071,398 ",N/A,N/A,True,
228,It Came from Outer Space,1953,Approved,5-Jun-53,81 min,"Horror, Sci-Fi",Jack Arnold,"Harry Essex, Ray Bradbury","Richard Carlson, Barbara Rush, Charles Drake",A spaceship from another world crashes in the Arizona desert and only an amateur stargazer and a schoolteacher suspect alien influence when the local townsfolk begin to act strangely.,English,United States,1 win & 3 nominations,https://m.media-amazon.com/images/M/MV5BOTUzNzM0MzQxMV5BMl5BanBnXkFtZTgwNTM5NDI1MDE@._V1_SX300.jpg,"[{'Source': 'Internet Movie Database', 'Value': '6.5/10'}, {'Source': 'Rotten Tomatoes', 'Value': '79%'}]",64.01811594,6.5,"35,786",tt0045920,movie,7-Oct-03," $40,071,397.78 ",N/A,N/A,True,
229,Creature from the Black Lagoon,1954,G,5-Mar-54,79 min,"Horror, Sci-Fi",Jack Arnold,"Harry Essex, Arthur A. Ross, Maurice Zimm","Richard Carlson, Julie Adams, Richard Denning",A strange prehistoric beast lurks in the depths of the Amazonian jungle. A group of scientists try to capture the animal and bring it back to civilization for study.,"English, Spanish",United States,1 win & 1 nomination,https://m.media-amazon.com/images/M/MV5BMjMwMjA5NDkyMl5BMl5BanBnXkFtZTgwMzYyMTY2MTE@._V1_SX300.jpg,"[{'Source': 'Internet Movie Database', 'Value': '7.0/10'}, {'Source': 'Rotten Tomatoes', 'Value': '79%'}, {'Source': 'Metacritic', 'Value': '68/100'}]",68,7,"35,786",tt0046876,movie,28-Aug-01," $40,071,397.78 ",N/A,N/A,True,
230,Revenge of the Creature,1955,Passed,22-Jul-55,82 min,"Horror, Sci-Fi",Jack Arnold,"William Alland, Martin Berkeley","John Agar, Lori Nelson, John Bromfield","Men capture the Creature from the Black Lagoon and make him an aquarium attraction, from which he escapes.",English,United States,Nothing,https://m.media-amazon.com/images/M/MV5BMTQxMDU3MjM0N15BMl5BanBnXkFtZTgwNTMzNTQ1MjE@._V1_SX300.jpg,"[{'Source': 'Internet Movie Database', 'Value': '5.7/10'}, {'Source': 'Rotten Tomatoes', 'Value': '13%'}]",64.01811594,5.7,"35,786",tt0048554,movie,19-Oct-04,"$40,071,398 ",N/A,N/A,True,
231,Tarantula,1955,Approved,20-Feb-56,80 min,"Horror, Sci-Fi",Jack Arnold,"Robert M. Fresco, Martin Berkeley, Jack Arnold","John Agar, Mara Corday, Leo G. Carroll",A spider escapes from an isolated Arizona desert laboratory experimenting in giantism and grows to tremendous size as it wreaks havoc on the local inhabitants.,English,United States,1 win,https://m.media-amazon.com/images/M/MV5BZjRmZjRkNjEtYjM1Ni00NTE2LWI4ZjMtMjVhZmNhZmU4MDg4XkEyXkFqcGdeQXVyMjI4MjA5MzA@._V1_SX300.jpg,"[{'Source': 'Internet Movie Database', 'Value': '6.5/10'}, {'Source': 'Rotten Tomatoes', 'Value': '94%'}]",64.01811594,6.5,"35,786",tt0048696,movie,13-May-08,"$40,071,398 ",N/A,N/A,True,
232,Red Sundown,1956,Passed,1-Mar-56,81 min,"Action, Drama, Romance",Jack Arnold,"Martin Berkeley, Lewis B. Patten","Rory Calhoun, Martha Hyer, Dean Jagger",A gunfighter takes a deputy sheriff job in a town caught in a feud between a powerful rancher and small farmers.,English,United States,Nothing,https://m.media-amazon.com/images/M/MV5BNjZiZTcwMTMtZmI1YS00N2U1LTgxNzgtOTA1MmJiNDdmZmVlXkEyXkFqcGdeQXVyNTk1MTk0MDI@._V1_SX300.jpg,"[{'Source': 'Internet Movie Database', 'Value': '6.5/10'}]",64.01811594,6.5,35785.50713,tt0049667,movie,N/A," $40,071,397.78 ",N/A,N/A,True,
233,Outside the Law,1920,Passed,6-Jan-21,75 min,"Crime, Romance, Thriller",Tod Browning,"Gardner Bradford, Tod Browning, Lucien Hubbard","Priscilla Dean, Wheeler Oakman, Lon Chaney","In this early collaboration with director Tod Browning (Dracula, Freaks), Chaney delivers a dual performance of dramatic intensity, starring as Ah Wing, a kind-hearted student of Confucian philosophy, and Black Mike Sylva, a murderou","None, English",United States,Nothing,https://m.media-amazon.com/images/M/MV5BZmIxNjFlMGEtZGQ4ZS00NzQyLWJiNDUtMGYwNmVjNWM3YmQzXkEyXkFqcGdeQXVyMjUxODE0MDY@._V1_SX300.jpg,"[{'Source': 'Internet Movie Database', 'Value': '6.6/10'}, {'Source': 'Rotten Tomatoes', 'Value': '100%'}]",64.01811594,6.6,35785.50713,tt0012538,movie,27-Jun-00," $40,071,397.78 ",N/A,N/A,True,
234,Man in the Shadow,1957,Approved,22-Jan-58,80 min,"Action, Crime, Drama",Jack Arnold,Gene L. Coon,"Jeff Chandler, Orson Welles, Colleen Miller","Virgil Renchler owns most of the town providing a thriving economy. When his men go too far and kill one of his migrant workmen, the sheriff goes after him even if it means his job and everyone else's.",English,United States,Nothing,https://m.media-amazon.com/images/M/MV5BOWU2MmY4YzQtODQxMC00YjQxLThjNTMtNWMyMmU3OGM0NjcxXkEyXkFqcGdeQXVyNTk1MTk0MDI@._V1_SX300.jpg,"[{'Source': 'Internet Movie Database', 'Value': '6.8/10'}]",64.01811594,6.8,35785.50713,tt0050680,movie,28-Mar-11," $40,071,397.78 ",N/A,N/A,True,
235,No Name on the Bullet,1959,Passed,1-Feb-59,77 min,"Action, Drama, Romance",Jack Arnold,"Gene L. Coon, Howard Amacker","Audie Murphy, Charles Drake, Joan Evans","When hired killer John Gant rides into Lordsburg, the town's folk become paranoid as each leading citizen has enemies capable of using the services of a professional killer for personal revenge.",English,United States,Nothing,https://m.media-amazon.com/images/M/MV5BMzNhYzQ4MGUtYWNmMy00YTMxLTk0N2QtNzljOTYyNzYwMDdiXkEyXkFqcGdeQXVyMTMxMTY0OTQ@._V1_SX300.jpg,"[{'Source': 'Internet Movie Database', 'Value': '7.3/10'}]",64.01811594,7.3,"35,786",tt0052002,movie,1-Jun-10," $40,071,397.78 ",N/A,N/A,True,
236,Bachelor in Paradise,2014–,TV-14,4-Aug-14,42 min,"Reality-TV, Romance",N/A,N/A,"Chris Harrison, Wells Adams, Carly Waddell",Contestants from the Bachelor and Bachelorette from previous seasons have another chance to fall in love in Bachelor in Paradise with other previous contestants.,English,"United States, Mexico",Nothing,https://m.media-amazon.com/images/M/MV5BZGQ3NzgzNDUtZWYwMi00YTg2LWEzZGMtNTgwZTUzYWUxODU3XkEyXkFqcGdeQXVyMzQ2MDI5NjU@._V1_SX300.jpg,"[{'Source': 'Internet Movie Database', 'Value': '5.3/10'}]",64.01811594,5.3,"35,786",tt3780132,series,," $40,071,397.78 ",,,True,7
237,Boss Nigger,1974,PG,18-Aug-75,87 min,"Comedy, Western",Jack Arnold,Fred Williamson,"Fred Williamson, D'Urville Martin, William Smith","Two black bounty hunters, pursuing an outlaw, take over a small Western town without a sheriff.",English,United States,Nothing,https://m.media-amazon.com/images/M/MV5BYWZlMmM0Y2QtMGNkMC00ZWU5LTkzOWYtMTUyYTMzZjU4NzlkL2ltYWdlL2ltYWdlXkEyXkFqcGdeQXVyNzc5MjA3OA@@._V1_SX300.jpg,"[{'Source': 'Internet Movie Database', 'Value': '6.5/10'}]",64.01811594,6.5,"35,786",tt0072725,movie,14-Aug-18," $40,071,397.78 ",N/A,N/A,True,
238,Life of Pi,2012,PG,21-Nov-12,127 min,"Adventure, Drama, Fantasy",Ang Lee,"Yann Martel, David Magee","Suraj Sharma, Irrfan Khan, Adil Hussain","A young man who survives a disaster at sea is hurtled into an epic journey of adventure and discovery. While cast away, he forms an unexpected connection with another survivor: a fearsome Bengal tiger.","English, Hindi, Japanese, French","United States, Taiwan, United Kingdom, Mexico, Canada, France, India",Won 4 Oscars. 81 wins & 134 nominations total,https://m.media-amazon.com/images/M/MV5BNTg2OTY2ODg5OF5BMl5BanBnXkFtZTcwODM5MTYxOA@@._V1_SX300.jpg,"[{'Source': 'Internet Movie Database', 'Value': '7.9/10'}, {'Source': 'Rotten Tomatoes', 'Value': '86%'}, {'Source': 'Metacritic', 'Value': '79/100'}]",79,7.9,"35,786",tt0454876,movie,12-Mar-13,"$40,071,398 ",N/A,N/A,True,
239,American Wrestler: The Wizard,2016,PG-13,16-May-17,117 min,"Drama, Sport",Alex Ranarivelo,"Ali Afshar, Brian Rudnick","George Thomas, William Fichtner, Ali Afshar","In 1980, a teenage boy escapes the unrest in Iran only to face more hostility in America, due to the hostage crisis. Determined to fit in, he joins the school's floundering wrestling team.","English, Persian, French, Spanish",United States,10 wins,https://m.media-amazon.com/images/M/MV5BNjY0ZDdjODgtNDg5Ny00MDliLWFkYTAtMmM1NjcyZDRhZmU2XkEyXkFqcGdeQXVyMDQ0Mzg2MQ@@._V1_SX300.jpg,"[{'Source': 'Internet Movie Database', 'Value': '7.2/10'}]",64.01811594,7.2,"35,786",tt4303202,movie,N/A," $40,071,397.78 ",N/A,N/A,True,
240,Beatriz at Dinner,2017,R,9-Jun-17,82 min,"Comedy, Drama",Miguel Arteta,Mike White,"Salma Hayek, John Lithgow, Connie Britton",A holistic medicine practitioner attends a wealthy client's dinner party after her car breaks down.,"English, Spanish",United States,2 wins & 8 nominations,https://m.media-amazon.com/images/M/MV5BNDU3M2EwZWEtMGQxZS00NmFjLTlhMDItMDU5NGU1MGUyZmVmXkEyXkFqcGdeQXVyNjU2NTMxOTg@._V1_SX300.jpg,"[{'Source': 'Internet Movie Database', 'Value': '6.0/10'}, {'Source': 'Rotten Tomatoes', 'Value': '75%'}, {'Source': 'Metacritic', 'Value': '68/100'}]",68,6,"35,786",tt5929750,movie,12-Sep-17,"$40,071,398 ",N/A,N/A,True,
241,Honor Among Lovers,1931,R,21-Mar-31,75 min,"Drama, Romance",Dorothy Arzner,"Austin Parker, Gertrude Purcell","Claudette Colbert, Fredric March, Monroe Owsley","Jerry Stafford, a businessman, is in love with his secretary but she deserts him for another man. When she realizes her mistake, she goes back to him. Doris Brown is her girlfriend who is in love with a man named Monty Dunn.",English,United States,Nothing,https://m.media-amazon.com/images/M/MV5BZDA0NDRkYmUtY2ZiMC00NTk2LWI5YjMtZjQxOTlhNWNlMjc5XkEyXkFqcGdeQXVyMjUxODE0MDY@._V1_SX300.jpg,"[{'Source': 'Internet Movie Database', 'Value': '6.9/10'}]",64.01811594,6.9,35785.50713,tt0021969,movie,N/A," $40,071,397.78 ",N/A,N/A,True,
242,Merrily We Go to Hell,1932,Not Rated,10-Jun-32,83 min,"Comedy, Drama, Romance",Dorothy Arzner,"Edwin Justus Mayer, Cleo Lucas","Sylvia Sidney, Fredric March, Adrianne Allen","A drunken newspaperman is rescued from his alcoholic haze by an heiress whose love sobers him up and encourages him to write a play, but he lapses back into dipsomania.",English,United States,Nothing,https://m.media-amazon.com/images/M/MV5BN2FhMTk2MGMtNWFkMC00MTc5LWIxZmYtMzhlYTJhMGM1Y2ZhXkEyXkFqcGdeQXVyMjc1NjE1MzM@._V1_SX300.jpg,"[{'Source': 'Internet Movie Database', 'Value': '6.9/10'}, {'Source': 'Rotten Tomatoes', 'Value': '100%'}]",64.01811594,6.9,"35,786",tt0023213,movie,7-Apr-09," $40,071,397.78 ",Paramount Pictures,N/A,True,
243,"Dance, Girl, Dance",1940,Approved,30-Aug-40,90 min,"Comedy, Drama, Music","Dorothy Arzner, Roy Del Ruth","Tess Slesinger, Frank Davis, Vicki Baum","Maureen O'Hara, Louis Hayward, Lucille Ball","When a troupe of danseuses becomes unemployed, one of them takes up burlesque dancing while another dreams of performing ballet.",English,United States,1 win,https://m.media-amazon.com/images/M/MV5BZDhhYjZkYzEtNGZkNS00NzUxLWJmODMtYjFjZDJlMTQyNjAzL2ltYWdlL2ltYWdlXkEyXkFqcGdeQXVyNjc1NTYyMjg@._V1_SX300.jpg,"[{'Source': 'Internet Movie Database', 'Value': '6.8/10'}, {'Source': 'Rotten Tomatoes', 'Value': '83%'}]",64.01811594,6.8,"35,786",tt0032376,movie,19-Jun-07," $40,071,397.78 ",N/A,N/A,True,
244,Christopher Strong,1933,Passed,31-Mar-33,78 min,"Action, Adventure, Drama",Dorothy Arzner,"Zoe Akins, Gilbert Frankau","Katharine Hepburn, Colin Clive, Billie Burke",A famous female flier and a member of Parliament drift into a potentially disastrous affair.,"English, French, German, Russian, Japanese, Latin",United States,Nothing,https://m.media-amazon.com/images/M/MV5BZGE1OTQ5MDctNDAwZS00YmM3LTgxZTgtZjhmMzYzNzVlN2M5XkEyXkFqcGdeQXVyMTc5NDc1MDI@._V1_SX300.jpg,"[{'Source': 'Internet Movie Database', 'Value': '6.3/10'}, {'Source': 'Rotten Tomatoes', 'Value': '80%'}]",64.01811594,6.3,"35,786",tt0023891,movie,20-Apr-09," $40,071,397.78 ",RKO Radio Pictures Inc.,N/A,True,
245,Shampoo,1975,R,13-Mar-75,110 min,"Comedy, Drama",Hal Ashby,"Robert Towne, Warren Beatty","Warren Beatty, Julie Christie, Goldie Hawn","On Election Day, 1968, a hairdresser and ladies' man is too busy cutting hair and dealing with his various girlfriends and his mistress, whose husband he meets and finds out is having an affair with his ex-girlfriend.",English,United States,Won 1 Oscar. 3 wins & 11 nominations total,https://m.media-amazon.com/images/M/MV5BZWE0YmFhMDctOGFkYS00ODNmLTgyMTMtNzBiNWE2ZmNjNzdjXkEyXkFqcGdeQXVyNjc1NTYyMjg@._V1_SX300.jpg,"[{'Source': 'Internet Movie Database', 'Value': '6.4/10'}, {'Source': 'Rotten Tomatoes', 'Value': '62%'}, {'Source': 'Metacritic', 'Value': '65/100'}]",65,6.4,"35,786",tt0073692,movie,16-Oct-18,"$40,071,398 ",N/A,N/A,True,
246,Bound for Glory,1976,PG,5-Dec-76,147 min,"Biography, Drama, Music",Hal Ashby,"Robert Getchell, Woody Guthrie","David Carradine, Ronny Cox, Melinda Dillon",The early life of Woody Guthrie as a vagabond folk singer.,English,United States,Won 2 Oscars. 6 wins & 11 nominations total,https://m.media-amazon.com/images/M/MV5BOWRlMmU0OGUtZjhjMS00YWQ2LWEzNzYtMWYxOWMwNjhkMGVkXkEyXkFqcGdeQXVyNjc1NTYyMjg@._V1_SX300.jpg,"[{'Source': 'Internet Movie Database', 'Value': '7.3/10'}, {'Source': 'Rotten Tomatoes', 'Value': '83%'}, {'Source': 'Metacritic', 'Value': '70/100'}]",70,7.3,"35,786",tt0074235,movie,29-Feb-00," $40,071,397.78 ",N/A,N/A,True,
247,Coming Home,1978,R,15-Feb-78,127 min,"Drama, Romance, War",Hal Ashby,"Waldo Salt, Robert C. Jones, Nancy Dowd","Jane Fonda, Jon Voight, Bruce Dern",A woman whose husband is fighting in Vietnam falls in love with another man who suffered a paralyzing combat injury there.,English,United States,Won 3 Oscars. 14 wins & 16 nominations total,https://m.media-amazon.com/images/M/MV5BNTZmMmE4YWQtNjhkYi00NGM0LWI4YTQtZjk2ZTJkNWE1MjVjXkEyXkFqcGdeQXVyMTA0MjU0Ng@@._V1_SX300.jpg,"[{'Source': 'Internet Movie Database', 'Value': '7.3/10'}, {'Source': 'Rotten Tomatoes', 'Value': '85%'}, {'Source': 'Metacritic', 'Value': '61/100'}]",61,7.3,"35,786",tt0077362,movie,16-Apr-02,"$40,071,398 ",N/A,N/A,True,
248,Being There,1979,PG,8-Feb-80,130 min,"Comedy, Drama",Hal Ashby,"Jerzy Kosinski, Robert C. Jones","Peter Sellers, Shirley MacLaine, Melvyn Douglas","A simpleminded, sheltered gardener becomes an unlikely trusted advisor to a powerful businessman and an insider in Washington politics.","English, Russian, Italian","West Germany, United States",Won 1 Oscar. 14 wins & 15 nominations total,https://m.media-amazon.com/images/M/MV5BNjAzNzJjYzQtMGFmNS00ZjAzLTkwMjgtMWIzYzFkMzM4Njg3XkEyXkFqcGdeQXVyMTY5Nzc4MDY@._V1_SX300.jpg,"[{'Source': 'Internet Movie Database', 'Value': '8.0/10'}, {'Source': 'Rotten Tomatoes', 'Value': '95%'}, {'Source': 'Metacritic', 'Value': '83/100'}]",83,8,"35,786",tt0078841,movie,5-Feb-02,"$40,071,398 ",N/A,N/A,True,
249,Johnny Cool,1963,Approved,2-Oct-63,103 min,"Action, Crime, Drama",William Asher,"Joseph Landon, John McPartland","Henry Silva, Elizabeth Montgomery, Richard Anderson",Exiled American gangster Colini sends his protégé-killer Giordano to the USA to eliminate Colini's mob enemies.,"English, Italian",United States,Nothing,https://m.media-amazon.com/images/M/MV5BMTAxMjY5OTQzMDleQTJeQWpwZ15BbWU4MDgyMzA5MDMx._V1_SX300.jpg,"[{'Source': 'Internet Movie Database', 'Value': '6.4/10'}, {'Source': 'Rotten Tomatoes', 'Value': '40%'}]",64.01811594,6.4,35785.50713,tt0057200,movie,27-Jun-11," $40,071,397.78 ",N/A,N/A,True,
250,Pygmalion,1938,Not Rated,3-Mar-39,89 min,"Comedy, Drama, Romance","Anthony Asquith, Leslie Howard","George Bernard Shaw, W.P. Lipscomb, Cecil Lewis","Leslie Howard, Wendy Hiller, Wilfrid Lawson",A phonetics and diction expert makes a bet that he can teach a cockney flower girl to speak proper English and pass as a lady in high society.,English,United Kingdom,Won 1 Oscar. 3 wins & 5 nominations total,https://m.media-amazon.com/images/M/MV5BNTgzN2NkMTAtYTc0Yy00ODc1LWI5ZTktNDIzNGFjY2M3NDhlXkEyXkFqcGdeQXVyMzg1ODEwNQ@@._V1_SX300.jpg,"[{'Source': 'Internet Movie Database', 'Value': '7.8/10'}, {'Source': 'Rotten Tomatoes', 'Value': '94%'}]",64.01811594,7.8,"35,786",tt0030637,movie,19-Sep-00," $40,071,397.78 ",N/A,N/A,True,
251,Fanny by Gaslight,1944,Approved,12-Mar-45,90 min,"Drama, Romance",Anthony Asquith,"Doreen Montgomery, Aimée Stuart, Michael Sadleir","Phyllis Calvert, James Mason, Wilfrid Lawson","Returning to 1870's London after finishing at boarding school, Fanny witnesses the death of her father in a fight with Lord Manderstoke. She then finds that her family has for many years been running a bordello next door to their hom",English,United Kingdom,Nothing,https://m.media-amazon.com/images/M/MV5BYzYwOTBlMWUtNjI3NS00ZjQzLWE4YjEtNmQ0NmNlNjQxZmVkXkEyXkFqcGdeQXVyNDYxOTY1Njg@._V1_SX300.jpg,"[{'Source': 'Internet Movie Database', 'Value': '6.5/10'}, {'Source': 'Rotten Tomatoes', 'Value': '50%'}]",64.01811594,6.5,35785.50713,tt0036814,movie,12-Nov-16," $40,071,397.78 ",N/A,N/A,True,
252,Kicking & Screaming: Behind the Net - The Making of 'Kicking & Screaming',2005,R,11-Oct-05,13 min,"Documentary, Short",N/A,N/A,"Leo Benvenuti, Jeremy Bergman, Elliott Cho, Mike Ditka",N/A,English,USA,Nothing,N/A,"[{'Source': 'Internet Movie Database', 'Value': '5.5/10'}]",64.01811594,5.5,35785.50713,tt0496766,movie,N/A," $40,071,397.78 ",N/A,N/A,True,
253,Ordre de tuer,2007,R,N/A,N/A,"Action, Crime, Drama",Emmanuel Buriez,Emmanuel Buriez,Emmanuel Buriez,N/A,French,France,Nothing,N/A,[],64.01811594,6.523828921,35785.50713,tt6097600,movie,N/A," $40,071,397.78 ",N/A,N/A,True,
254,Paris s'éveille,1991,R,27-Nov-91,95 min,Drama,Olivier Assayas,Olivier Assayas,"Judith Godrèche, Jean-Pierre Léaud, Thomas Langmann","Adrien is 19 years old. He has not met his father, Clément for 4 years. Adrien returns home and the two try to better understand each other. Clément lives together with Louis, a twenty-something girl who wants to be an actress. The b",French,"France, Italy",3 wins & 2 nominations,https://m.media-amazon.com/images/M/MV5BNzFhMjI5N2UtNzhiMC00ZjQyLThkNTItYmIyZWZkZDIwODUyXkEyXkFqcGdeQXVyMzU0NzkwMDg@._V1_SX300.jpg,"[{'Source': 'Internet Movie Database', 'Value': '6.3/10'}]",64.01811594,6.3,35785.50713,tt0102639,movie,N/A," $40,071,397.78 ",Columbia,N/A,True,
255,Paris s'éveille,1991,R,27-Nov-91,95 min,Drama,Olivier Assayas,Olivier Assayas,"Judith Godrèche, Jean-Pierre Léaud, Thomas Langmann","Adrien is 19 years old. He has not met his father, Clément for 4 years. Adrien returns home and the two try to better understand each other. Clément lives together with Louis, a twenty-something girl who wants to be an actress. The b",French,"France, Italy",3 wins & 2 nominations,https://m.media-amazon.com/images/M/MV5BNzFhMjI5N2UtNzhiMC00ZjQyLThkNTItYmIyZWZkZDIwODUyXkEyXkFqcGdeQXVyMzU0NzkwMDg@._V1_SX300.jpg,"[{'Source': 'Internet Movie Database', 'Value': '6.3/10'}]",64.01811594,6.3,35785.50713,tt0102639,movie,N/A," $40,071,397.78 ",Columbia,N/A,True,
256,"Fin août, début septembre",1998,R,10-Feb-99,112 min,"Drama, Romance",Olivier Assayas,Olivier Assayas,"Mathieu Amalric, Virginie Ledoyen, François Cluzet","A story about the transition from late youth to early maturity, the film follows several friends and lovers as they come to make decisions on how to live their lives--getting a job more in harmony with ones ideals, committing to a lo",French,France,2 wins & 1 nomination,https://m.media-amazon.com/images/M/MV5BYTBlMmQ2YjUtNTAyMy00ZmZjLTgyZGYtZmYyMDQ3YjRiNTA5XkEyXkFqcGdeQXVyMTA0MjU0Ng@@._V1_SX300.jpg,"[{'Source': 'Internet Movie Database', 'Value': '7.0/10'}, {'Source': 'Rotten Tomatoes', 'Value': '82%'}]",64.01811594,7,"35,786",tt0167925,movie,27-May-03,"$40,071,398 ",N/A,N/A,True,
257,Boarding Gate,2007,R,22-Aug-07,106 min,"Drama, Thriller",Olivier Assayas,Olivier Assayas,"Asia Argento, Michael Madsen, Kelly Lin","A beautiful woman, Sandra, seduces a wealthy businessman, Miles Rennburg. Little does he realise that she has been sent to kill him at the behest of her boyfriend/crime partner, Lester. Controlling all this is Sue, Lester's wife.","English, French, Cantonese","France, Luxembourg, Hong Kong",1 nomination,https://m.media-amazon.com/images/M/MV5BYjQ1NWNjZmQtZTI1MS00OWM1LWFmNzktNDAxYjBhNTAwZWI0XkEyXkFqcGdeQXVyNTE0MDY4Mjk@._V1_SX300.jpg,"[{'Source': 'Internet Movie Database', 'Value': '5.1/10'}, {'Source': 'Rotten Tomatoes', 'Value': '32%'}, {'Source': 'Metacritic', 'Value': '47/100'}]",47,5.1,"35,786",tt0493402,movie,3-Jun-08,"$40,071,398 ",N/A,N/A,True,
258,Doubles vies,2018,R,3-May-19,108 min,"Comedy, Drama, Romance",Olivier Assayas,Olivier Assayas,"Guillaume Canet, Juliette Binoche, Vincent Macaigne","Set in the Parisian publishing world, an editor and an author find themselves in over their heads, as they cope with a middle-age crisis, the changing industry and their wives.",French,France,3 wins & 9 nominations,https://m.media-amazon.com/images/M/MV5BYzYxMTZlMGUtMGM2MC00ZjdhLWI1MjItMGY4YjliMzI0YTlhXkEyXkFqcGdeQXVyODY3Nzc0OTk@._V1_SX300.jpg,"[{'Source': 'Internet Movie Database', 'Value': '6.5/10'}, {'Source': 'Rotten Tomatoes', 'Value': '87%'}, {'Source': 'Metacritic', 'Value': '78/100'}]",78,6.5,"35,786",tt7250056,movie,3-Aug-19,"$40,071,398 ",N/A,N/A,True,
259,"Madagascar: une belle vie, une belle mort",2014,R,N/A,41 min,"Documentary, Short",Riccardo Bononi,N/A,N/A,"The British anthropologist Geoffrey Gorer said that death has become 'pornographic' to us, an obscene content from which children must be kept safe. The first and the main western taboo. The western obsession about death has seen as ",N/A,"Italy, Madagascar",Nothing,N/A,[],64.01811594,6.523828921,35785.50713,tt3723202,movie,N/A," $40,071,397.78 ",N/A,N/A,True,
260,Evariste Galois,1965,R,1-May-65,30 min,Short,Alexandre Astruc,Alexandre Astruc,"José Varela, Vincent Kaldor, François Perrot, Gérard Dauzat",N/A,French,France,1 nomination.,https://m.media-amazon.com/images/M/MV5BYWIzZDUwODctNzQ1My00NjhiLWIzODQtZWE1MTRjNzlhZWY1XkEyXkFqcGdeQXVyNzU3NjUzNTc@._V1_SX300.jpg,"[{'Source': 'Internet Movie Database', 'Value': '7.2/10'}]",64.01811594,7.2,35785.50713,tt0205913,movie,N/A," $40,071,397.78 ",N/A,N/A,True,
261,Flammes sur l'Adriatique,1968,R,18-Aug-68,91 min,War,"Alexandre Astruc, Stjepan Cikes","Mesa Selimovic, Jean Curtelin, Vladimir Balvanovic","Gérard Barray, Claudine Auger, Raoul Saint-Yves","In April 1941,Germany invaded Yugoslavia without a declaration of war;aboard a destroyer ,opinions differ:shall we surrender or shall we join the British fleet in Malta?Two young lieutenants would like to continue the war,but their s",French,"Yugoslavia, France",Nothing,https://m.media-amazon.com/images/M/MV5BMjA5MTUyNDQxNl5BMl5BanBnXkFtZTcwMzg2NjYxNA@@._V1_SX300.jpg,"[{'Source': 'Internet Movie Database', 'Value': '5.2/10'}]",64.01811594,5.2,35785.50713,tt0142297,movie,2-Nov-10," $40,071,397.78 ",Pathfinder Home Entertainment,N/A,True,
262,Mia melissa ton Avgousto,2007,R,1-Feb-07,95 min,"Comedy, Drama, Romance",Thodoris Atheridis,Thodoris Atheridis,"Thodoris Atheridis, Smaragda Karydi, Vicky Volioti","Harris, his wife, his mistress and his half German sister arrive with a boat to a distant Aegean island, assessable only by boat. The boat man forgets them and they are stranded there. Harris gets stung by a bee, and he develops an a","Greek, German",Greece,Nothing,https://m.media-amazon.com/images/M/MV5BOTAxYTkyODktYzg0Yi00YzRlLTkxYjYtYWEyNDI1NjI5ZGMzXkEyXkFqcGdeQXVyMzQ3Nzk5MTU@._V1_SX300.jpg,"[{'Source': 'Internet Movie Database', 'Value': '5.2/10'}]",64.01811594,5.2,"35,786",tt0970946,movie,N/A," $40,071,397.78 ",N/A,N/A,True,
263,A Chorus Line,1985,PG-13,20-Dec-85,113 min,"Drama, Music, Musical",Richard Attenborough,"Arnold Schulman, Michael Bennett, James Kirkwood Jr.","Michael Douglas, Terrence Mann, Michael Blevins",Hopefuls try out before a demanding director for a part in a new musical.,English,United States,Nominated for 3 Oscars. 8 nominations total,https://m.media-amazon.com/images/M/MV5BMTYzOTIwOTA1NF5BMl5BanBnXkFtZTcwMDg4NzQzNA@@._V1_SX300.jpg,"[{'Source': 'Internet Movie Database', 'Value': '6.2/10'}, {'Source': 'Rotten Tomatoes', 'Value': '40%'}, {'Source': 'Metacritic', 'Value': '46/100'}]",46,6.2,"35,786",tt0088915,movie,15-Apr-03,"$40,071,398 ",N/A,N/A,True,
264,Regarde les hommes tomber,1994,R,31-Aug-94,90 min,"Crime, Drama",Jacques Audiard,"Jacques Audiard, Alain Le Henry, Teri White","Jean-Louis Trintignant, Jean Yanne, Mathieu Kassovitz","Simon is a sales representative about fifty. When Mickey, his cop friend, is being shot, he leaves everything to find the murderers. Two years before, Marx, an old gambler, met Frederic, a young man that does not look very smart and ",French,France,3 wins & 2 nominations,https://m.media-amazon.com/images/M/MV5BZjAyOGVjYTMtZGJlMi00M2U4LTg1ZTQtNjIxNTIwODkxYmRlXkEyXkFqcGdeQXVyMzU0NzkwMDg@._V1_SX300.jpg,"[{'Source': 'Internet Movie Database', 'Value': '6.6/10'}, {'Source': 'Metacritic', 'Value': '69/100'}]",69,6.6,"35,786",tt0110958,movie,8-Jan-08," $40,071,397.78 ",N/A,N/A,True,
