,Title,Year,Rated,Released,Runtime,Genre,Director,Writer,Actors,Plot,Language,Country,Awards,Poster,Ratings,Metascore,imdbRating,imdbVotes,imdbID,Type,DVD,BoxOffice,Production,Website,Response,totalSeasons
495,Deepwater Horizon,2016,PG-13,30-Sep-16,107 min,"Action, Drama, History",Peter Berg,"Matthew Michael Carnahan, Matthew Sand, David Barstow","Mark Wahlberg, Kurt Russell, Douglas M. Griffin","A dramatization of the disaster in April 2010, when the offshore drilling rig called the Deepwater Horizon exploded, resulting in the worst oil spill in American history.",English,"United States, Hong Kong, China",Nominated for 2 Oscars. 3 wins & 15 nominations total,https://m.media-amazon.com/images/M/MV5BOTEzNDU0OTgxM15BMl5BanBnXkFtZTgwNjA0ODM2OTE@._V1_SX300.jpg,"[{'Source': 'Internet Movie Database', 'Value': '7.1/10'}, {'Source': 'Rotten Tomatoes', 'Value': '83%'}, {'Source': 'Metacritic', 'Value': '68/100'}]",68,7.1,"35,786",tt1860357,movie,10-Jan-17,"$40,071,398 ",N/A,N/A,True,
496,It Could Happen to You,1994,PG,29-Jul-94,101 min,"Comedy, Drama, Romance",Andrew Bergman,Jane Anderson,"Nicolas Cage, Bridget Fonda, Rosie Perez",A police officer promises to share his lottery ticket with a waitress in lieu of a tip.,"English, Spanish",United States,Nothing,https://m.media-amazon.com/images/M/MV5BYzMxOGUzOWEtMGUxMi00ZWM1LWE3ODgtNzc4OGVjZmJhMmFmXkEyXkFqcGdeQXVyODY0NzcxNw@@._V1_SX300.jpg,"[{'Source': 'Internet Movie Database', 'Value': '6.4/10'}, {'Source': 'Rotten Tomatoes', 'Value': '71%'}, {'Source': 'Metacritic', 'Value': '64/100'}]",64,6.4,"35,786",tt0110167,movie,25-Aug-98,"$40,071,398 ",N/A,N/A,True,
497,Sommaren med Monika,1953,R,9-Feb-53,96 min,"Drama, Romance",Ingmar Bergman,"Per Anders Fogelström, Ingmar Bergman","Harriet Andersson, Lars Ekborg, Dagmar Ebbesen","A pair of teenagers meet one summer day, start a reckless affair and abandon their families to be with one another.",Swedish,Sweden,Nothing,https://m.media-amazon.com/images/M/MV5BYWRkYTBjNzgtZmE3OC00MTNhLTk5MzMtOWJjYjJmMmFiZGFlXkEyXkFqcGdeQXVyOTc5MDI5NjE@._V1_SX300.jpg,"[{'Source': 'Internet Movie Database', 'Value': '7.5/10'}, {'Source': 'Rotten Tomatoes', 'Value': '100%'}]",64.01811594,7.5,"35,786",tt0046345,movie,29-May-12," $40,071,397.78 ",N/A,N/A,True,
498,Gycklarnas afton,1953,Not Rated,9-Apr-56,93 min,Drama,Ingmar Bergman,Ingmar Bergman,"Åke Grönberg, Harriet Andersson, Hasse Ekman","The complicated relationships between a circus ringmaster, his estranged wife and his lover.",Swedish,Sweden,1 nomination,https://m.media-amazon.com/images/M/MV5BN2EyZmJiMTYtMDA0ZS00NGVkLTgzMjQtYmEzZWNjZWJhNTM5XkEyXkFqcGdeQXVyNzQxNDExNTU@._V1_SX300.jpg,"[{'Source': 'Internet Movie Database', 'Value': '7.5/10'}, {'Source': 'Rotten Tomatoes', 'Value': '100%'}]",64.01811594,7.5,"35,786",tt0045848,movie,20-Nov-07," $40,071,397.78 ",N/A,N/A,True,
499,Sommarnattens leende,1955,Not Rated,23-Dec-57,109 min,"Comedy, Romance",Ingmar Bergman,Ingmar Bergman,"Ulla Jacobsson, Eva Dahlbeck, Harriet Andersson","In Sweden at the turn of the century, members of the upper class and their servants find themselves in a romantic tangle that they try to work out amidst jealousy and heartbreak.",Swedish,Sweden,2 wins & 5 nominations total,https://m.media-amazon.com/images/M/MV5BZjY0Zjg3MGItMTc5Yy00MTlmLThhZjMtZGIzNDI1ZjFjN2VmXkEyXkFqcGdeQXVyNzQxNDExNTU@._V1_SX300.jpg,"[{'Source': 'Internet Movie Database', 'Value': '7.8/10'}, {'Source': 'Rotten Tomatoes', 'Value': '100%'}]",64.01811594,7.8,"35,786",tt0048641,movie,25-May-04," $40,071,397.78 ",N/A,N/A,True,
500,Nära livet,1958,Not Rated,31-Mar-58,84 min,Drama,Ingmar Bergman,"Ingmar Bergman, Ulla Isaksson","Eva Dahlbeck, Ingrid Thulin, Bibi Andersson","Three women in a maternity ward reveal their lives and intimate thoughts to each other while in a maternity ward together, where they face the choice of keeping their babies or offering them for adoption.",Swedish,Sweden,3 wins & 1 nomination,https://m.media-amazon.com/images/M/MV5BMTA2NTkzMDgxNTBeQTJeQWpwZ15BbWU4MDQyNTYyMTMx._V1_SX300.jpg,"[{'Source': 'Internet Movie Database', 'Value': '7.5/10'}]",64.01811594,7.5,"35,786",tt0052017,movie,20-Nov-18," $40,071,397.78 ",N/A,N/A,True,
501,Smultronstället,1957,Not Rated,22-Jun-59,91 min,"Drama, Romance",Ingmar Bergman,Ingmar Bergman,"Victor Sjöström, Bibi Andersson, Ingrid Thulin","After living a life marked by coldness, an aging professor is forced to confront the emptiness of his existence.","Swedish, Latin",Sweden,Nominated for 1 Oscar. 18 wins & 4 nominations total,https://m.media-amazon.com/images/M/MV5BZjJhNTBmNTgtMDViOC00NDY2LWE4N2ItMDJiM2ZiYmQzYzliXkEyXkFqcGdeQXVyMzg1ODEwNQ@@._V1_SX300.jpg,"[{'Source': 'Internet Movie Database', 'Value': '8.2/10'}, {'Source': 'Rotten Tomatoes', 'Value': '96%'}, {'Source': 'Metacritic', 'Value': '88/100'}]",88,8.2,"35,786",tt0050986,movie,12-Feb-02," $40,071,397.78 ",N/A,N/A,True,
502,Jungfrukällan,1960,Not Rated,14-Nov-60,89 min,Drama,Ingmar Bergman,Ulla Isaksson,"Max von Sydow, Birgitta Valberg, Gunnel Lindblom","An innocent yet pampered young virgin and her family's pregnant and jealous servant set out to deliver candles to church, but only one returns from events that transpire in the woods along the way.","Swedish, German",Sweden,Won 1 Oscar. 6 wins & 2 nominations total,https://m.media-amazon.com/images/M/MV5BZjgyMzZkMGUtNTBhZC00OTkzLWI4ZmMtYzcwMzc5MjQ0YTM3XkEyXkFqcGdeQXVyMTMxMTY0OTQ@._V1_SX300.jpg,"[{'Source': 'Internet Movie Database', 'Value': '8.1/10'}, {'Source': 'Rotten Tomatoes', 'Value': '87%'}]",64.01811594,8.1,"35,786",tt0053976,movie,24-Jan-06," $40,071,397.78 ",N/A,N/A,True,
503,Djävulens öga,1960,Not Rated,17-Oct-60,87 min,"Comedy, Drama, Fantasy",Ingmar Bergman,"Oluf Bang, Ingmar Bergman","Jarl Kulle, Bibi Andersson, Stig Järrel",Don Juan is sent from Hell to Earth with a mission - to seduce a 20 years old virgin in order to spoil her pure wedding. The mission becomes crazy when Don Juan falls in love for the first time in centuries.,Swedish,Sweden,Nothing,https://m.media-amazon.com/images/M/MV5BNDFiYWNiNWItYmRkZC00OGYyLWIyY2QtMzU5OGViZDAxOGZiXkEyXkFqcGdeQXVyMTMxMTY0OTQ@._V1_SX300.jpg,"[{'Source': 'Internet Movie Database', 'Value': '7.1/10'}, {'Source': 'Rotten Tomatoes', 'Value': '67%'}]",64.01811594,7.1,"35,786",tt0053772,movie,20-Nov-18," $40,071,397.78 ",N/A,N/A,True,
504,Såsom i en spegel,1961,Not Rated,16-Oct-61,90 min,Drama,Ingmar Bergman,Ingmar Bergman,"Harriet Andersson, Gunnar Björnstrand, Max von Sydow","Recently released from a mental hospital, Karin rejoins her emotionally disconnected family in their island home, only to slip from reality as she begins to believe she is being visited by God.","Swedish, Latin",Sweden,Won 1 Oscar. 3 wins & 5 nominations total,https://m.media-amazon.com/images/M/MV5BNTM0MjcxN2MtNWVkMS00YmM5LTgzZTktNWY5NThjNTFjM2Y5XkEyXkFqcGdeQXVyNzQxNDExNTU@._V1_SX300.jpg,"[{'Source': 'Internet Movie Database', 'Value': '8.0/10'}, {'Source': 'Rotten Tomatoes', 'Value': '100%'}]",64.01811594,8,"35,786",tt0055499,movie,19-Aug-03," $40,071,397.78 ",N/A,N/A,True,
505,Nattvardsgästerna,1963,Not Rated,5-Apr-63,81 min,Drama,Ingmar Bergman,Ingmar Bergman,"Ingrid Thulin, Gunnar Björnstrand, Gunnel Lindblom",A small-town priest struggles with his faith.,Swedish,Sweden,2 wins & 1 nomination,https://m.media-amazon.com/images/M/MV5BNGRkMjI0ZjAtNTAyYy00ZjE2LWFkZWUtNDQ2YzQ4MmI1ZTA2XkEyXkFqcGdeQXVyNjMwMjk0MTQ@._V1_SX300.jpg,"[{'Source': 'Internet Movie Database', 'Value': '8.1/10'}, {'Source': 'Rotten Tomatoes', 'Value': '73%'}]",64.01811594,8.1,"35,786",tt0057358,movie,19-Aug-03," $40,071,397.78 ",N/A,N/A,True,
506,Tystnaden,1963,R,3-Feb-64,96 min,Drama,Ingmar Bergman,Ingmar Bergman,"Ingrid Thulin, Gunnel Lindblom, Birger Malmsten","Two estranged sisters, Ester and Anna, and Anna's 10-year-old son travel to the Central European country on the verge of war. Ester becomes seriously ill and the three of them move into a hotel in a small town called Timoka.","Swedish, English, German, French, Spanish",Sweden,3 wins & 2 nominations,https://m.media-amazon.com/images/M/MV5BOTc3ZjFlNTAtNTExNS00NzM4LWJiZjgtNjBhZTc2MWM3ZTYxXkEyXkFqcGdeQXVyMDgyNjA5MA@@._V1_SX300.jpg,"[{'Source': 'Internet Movie Database', 'Value': '7.9/10'}, {'Source': 'Rotten Tomatoes', 'Value': '88%'}]",64.01811594,7.9,"35,786",tt0057611,movie,19-Aug-03," $40,071,397.78 ",N/A,N/A,True,
507,Persona,1966,Not Rated,16-Mar-67,83 min,"Drama, Thriller",Ingmar Bergman,Ingmar Bergman,"Bibi Andersson, Liv Ullmann, Margaretha Krook",A nurse is put in charge of a mute actress and finds that their personae are melding together.,"Swedish, English",Sweden,11 wins & 5 nominations total,https://m.media-amazon.com/images/M/MV5BMTM0YzExY2EtMjUyZi00ZmIwLWFkYTktNjY5NmVkYTdkMjI5XkEyXkFqcGdeQXVyNzQxNDExNTU@._V1_SX300.jpg,"[{'Source': 'Internet Movie Database', 'Value': '8.1/10'}, {'Source': 'Rotten Tomatoes', 'Value': '91%'}, {'Source': 'Metacritic', 'Value': '86/100'}]",86,8.1,"35,786",tt0060827,movie,10-Feb-04," $40,071,397.78 ",N/A,N/A,True,
508,Vargtimmen,1968,Not Rated,9-Apr-68,90 min,"Drama, Horror",Ingmar Bergman,Ingmar Bergman,"Max von Sydow, Liv Ullmann, Gertrud Fridh","While vacationing on a remote Scandanavian island with his younger pregnant wife, an artist has an emotional breakdown while confronting his repressed desires.","Swedish, Norwegian",Sweden,2 wins,https://m.media-amazon.com/images/M/MV5BZmVlYmE4YjMtYjNiOS00ODQ1LWI1ZDYtOWQzNGZmNjBiZDZlXkEyXkFqcGdeQXVyNzQxNDExNTU@._V1_SX300.jpg,"[{'Source': 'Internet Movie Database', 'Value': '7.6/10'}, {'Source': 'Rotten Tomatoes', 'Value': '92%'}]",64.01811594,7.6,"35,786",tt0063759,movie,20-Nov-18," $40,071,397.78 ",N/A,N/A,True,
509,Skammen,1968,R,23-Dec-68,103 min,Drama,Ingmar Bergman,Ingmar Bergman,"Liv Ullmann, Max von Sydow, Sigge Fürst","In the midst of a civil war, former violinists Jan and Eva Rosenberg, who have a tempestuous marriage, run a farm on a rural island. In spite of their best efforts to escape their homeland, the war impinges on every aspect of their l",Swedish,Sweden,9 wins & 4 nominations,https://m.media-amazon.com/images/M/MV5BOTMxZmNiMTQtYTI3NS00ODUxLThjYjQtMTU2M2JmMjMzYjcxXkEyXkFqcGdeQXVyNjMwOTA1MDM@._V1_SX300.jpg,"[{'Source': 'Internet Movie Database', 'Value': '8.0/10'}, {'Source': 'Rotten Tomatoes', 'Value': '65%'}]",64.01811594,8,"35,786",tt0063611,movie,20-Apr-04," $40,071,397.78 ",N/A,N/A,True,
510,Viskningar och rop,1972,R,5-Mar-73,91 min,Drama,Ingmar Bergman,Ingmar Bergman,"Harriet Andersson, Liv Ullmann, Kari Sylwan","When a woman dying of cancer in early twentieth-century Sweden is visited by her two sisters, long-repressed feelings between the siblings rise to the surface.","Swedish, German, Danish",Sweden,Won 1 Oscar. 23 wins & 16 nominations total,https://m.media-amazon.com/images/M/MV5BMTg3NzYzOTEtNmE2Ni00M2EyLWJhMjctNjMyMTk4ZTViOGUzXkEyXkFqcGdeQXVyNzQxNDExNTU@._V1_SX300.jpg,"[{'Source': 'Internet Movie Database', 'Value': '8.1/10'}, {'Source': 'Rotten Tomatoes', 'Value': '90%'}]",64.01811594,8.1,"35,786",tt0069467,movie,1-Apr-14," $40,071,397.78 ",N/A,N/A,True,
511,"Surcouf, l'eroe dei sette mari",1966,R,28-Jun-67,85 min,Adventure,"Sergio Bergonzelli, Roy Rowland","Guy Farrell, Georges de La Grandière, Gerald Savery","Gérard Barray, Antonella Lualdi, Terence Morgan",A famous scientist vanishes after falling into a trap set by swindlers using treasure as a lure.,Italian,"Italy, France, Spain",Nothing,https://m.media-amazon.com/images/M/MV5BYmVmYjhhNGYtMWQ4NC00YWFmLWJiM2EtZDYwOTJiZTRhODM0XkEyXkFqcGdeQXVyNzc5MjA3OA@@._V1_SX300.jpg,"[{'Source': 'Internet Movie Database', 'Value': '5.8/10'}]",64.01811594,5.8,35785.50713,tt0061047,movie,N/A," $40,071,397.78 ",N/A,N/A,True,
512,Wild Mustang,1935,Passed,22-Oct-35,62 min,"Action, Adventure, Western",Harry L. Fraser,Harry L. Fraser (screenplay),"Harry Carey, Barbara Fritchie, Del Gordon, Katheryn Johns","Prison escapee Utah Evans kills Sheriff McClay. Joe Norton was McClay's predecessor and sent Utah to prison. Ma McClay having taken over as Sheriff for her husband, now gets Joe to return. ...",English,USA,Nothing,https://m.media-amazon.com/images/M/MV5BMDFlOTYzNjgtOTM1Zi00YjQ5LTk2YzctMWUzMmZjMzJiMWE2L2ltYWdlL2ltYWdlXkEyXkFqcGdeQXVyMDMxMjQwMw@@._V1_SX300.jpg,"[{'Source': 'Internet Movie Database', 'Value': '6.0/10'}]",64.01811594,6,35785.50713,tt0027217,movie,N/A," $40,071,397.78 ",N/A,N/A,True,
513,Toll of the Desert,1935,Approved,5-May-35,60 min,Western,William Berke,"Allen Hall, Miller Easton","Fred Kohler Jr., Betty Mack, Roger Williams","When his family is killed by Indians, a bitter cowboy turns into a ruthless hired gunman. Unbeknownst to him, his son had survived the attack, and is now a lawman. The son, not knowing that the killer is his father, is assigned to br",English,United States,Nothing,https://m.media-amazon.com/images/M/MV5BNDkwNzA3ODA0Nl5BMl5BanBnXkFtZTcwNzQyMjQ1OA@@._V1_SX300.jpg,"[{'Source': 'Internet Movie Database', 'Value': '5.4/10'}]",64.01811594,5.4,35785.50713,tt0028393,movie,N/A," $40,071,397.78 ",William Berke,N/A,True,
514,That's My Baby!,1944,Approved,14-Sep-44,68 min,"Comedy, Drama",William Berke,"Nicholas T. Barrows, William Tunberg, Irving Wallace","Richard Arlen, Ellen Drew, Leonid Kinskey",Father runs a big corporation but is suffering from a severe case of melancholia. Daughter and persona non-grata boyfriend cook up a plan to have every ex-vaudevillian and dancer on the club circuit that they can find attempt to make,English,United States,Nothing,https://m.media-amazon.com/images/M/MV5BMTkxNjgwOTM0OV5BMl5BanBnXkFtZTgwNTA4NjU5OTE@._V1_SX300.jpg,"[{'Source': 'Internet Movie Database', 'Value': '5.2/10'}]",64.01811594,5.2,35785.50713,tt0037361,movie,26-Sep-06," $40,071,397.78 ",Walter Colmes Productions,N/A,True,
515,Why Girls Leave Home,1945,Approved,9-Oct-45,69 min,"Crime, Drama, Music",William Berke,"Fanya Foss, Bradford Ropes","Lola Lane, Sheldon Leonard, Pamela Blake","Diana Leslie is rescued from drowning by reporter Chris Williams. The latter believes it is an attempted murder rather than the suicide indicated by a note, since the girl had made an appointment to meet him at the dock. The story is",English,United States,Nominated for 2 Oscars. 2 nominations total,https://m.media-amazon.com/images/M/MV5BNTI2OTE5MTk4OV5BMl5BanBnXkFtZTgwMTA1MTY0MjE@._V1_SX300.jpg,"[{'Source': 'Internet Movie Database', 'Value': '5.4/10'}]",64.01811594,5.4,35785.50713,tt0038249,movie,N/A," $40,071,397.78 ",N/A,N/A,True,
516,Dick Tracy,1990,PG,15-Jun-90,105 min,"Action, Comedy, Crime",Warren Beatty,"Chester Gould, Jim Cash, Jack Epps Jr.","Warren Beatty, Madonna, Al Pacino",The comic strip detective finds his life vastly complicated when Breathless Mahoney makes advances towards him while he is trying to battle Big Boy Caprice's united mob.,English,United States,Won 3 Oscars. 9 wins & 36 nominations total,https://m.media-amazon.com/images/M/MV5BMzA5MDg5ZDAtOWE1YS00Nzg2LTk5NzUtMDY3ZDZlN2U2M2ZlXkEyXkFqcGdeQXVyNjUwNzk3NDc@._V1_SX300.jpg,"[{'Source': 'Internet Movie Database', 'Value': '6.1/10'}, {'Source': 'Rotten Tomatoes', 'Value': '63%'}, {'Source': 'Metacritic', 'Value': '68/100'}]",68,6.1,"35,786",tt0099422,movie,1-Jan-04,"$40,071,398 ",N/A,N/A,True,
517,Double Exposure,1982,R,9-Nov-83,94 min,"Crime, Horror",William Byron Hillman,William Byron Hillman,"Michael Callan, Joanna Pettet, James Stacy",A photographer plagued by horrific nightmares in which he kills the young female models he shoots is shocked to discover that there is a serial killer in his city who is targeting attractive women.,English,United States,Nothing,https://m.media-amazon.com/images/M/MV5BMjE2MDUwNTUxNF5BMl5BanBnXkFtZTcwNzE4NjE1MQ@@._V1_SX300.jpg,"[{'Source': 'Internet Movie Database', 'Value': '4.9/10'}]",64.01811594,4.9,35785.50713,tt0073537,movie,N/A," $40,071,397.78 ",N/A,N/A,True,
518,Sunset Pass,1946,Passed,8-Jul-46,64 min,"Action, Adventure, Romance, Western",William Berke,"Zane Grey (novel), Norman Houston (screenplay)","James Warren, Nan Leslie, John Laurenz, Jane Greer","A young outlaw gets involved with a gang of crooks. When he tells them he is breaking away, they threaten to pin a false murder charge on him. But he is rescued and reformed by his sister, and an undercover agent for the express company.",English,USA,Nothing,https://m.media-amazon.com/images/M/MV5BNzk4MmFkZmQtNTMyNy00YmFiLWE4NzMtNGRjZWZhZDdjOWFmXkEyXkFqcGdeQXVyMDMxMjQwMw@@._V1_SX300.jpg,"[{'Source': 'Internet Movie Database', 'Value': '5.7/10'}]",64.01811594,5.7,35785.50713,tt0038996,movie,6-Jun-06," $40,071,397.78 ",N/A,N/A,True,
519,Renegade Girl,1946,Approved,25-Dec-46,65 min,Western,William Berke,Edwin V. Westrate,"Ann Savage, Alan Curtis, Edward Brophy","Ann Shelby, whose family is allied with the notorious William Quantrill, turns outlaw to revenge herself on a renegade Indian who killed her brother.",English,United States,Nothing,https://m.media-amazon.com/images/M/MV5BMTcyNjg4NzU2Nl5BMl5BanBnXkFtZTgwNTI3NDQ0MjE@._V1_SX300.jpg,"[{'Source': 'Internet Movie Database', 'Value': '5.1/10'}]",64.01811594,5.1,35785.50713,tt0038877,movie,30-May-06," $40,071,397.78 ",VCI,N/A,True,
520,Deputy Marshal,1949,Approved,28-Oct-49,60 min,Western,William Berke,"William Berke, Charles Heckelmann","Jon Hall, Frances Langford, Dick Foran","A Deputy Marshal tracks fugitive bank robbers to Wyoming, and then fights to help ranchers save their land from a railroad land scheme.",English,United States,Nothing,https://m.media-amazon.com/images/M/MV5BNDhjMjk1MzEtZTczMi00YmZiLTg0YWQtOTUyZWM1ZTU2ZTI2XkEyXkFqcGdeQXVyMTQ3Njg3MQ@@._V1_SX300.jpg,"[{'Source': 'Internet Movie Database', 'Value': '5.8/10'}]",64.01811594,5.8,35785.50713,tt0041289,movie,N/A," $40,071,397.78 ",N/A,N/A,True,
521,Operation Haylift,1950,Not Rated,5-May-50,73 min,Drama,William Berke,"Dean Riesner, Joe Sawyer","Bill Williams, Ann Rutherford, Tom Brown","Eighteen snowstorms in 27 days hit the Rocky Mountain and upper Great Plains states in December 1948-January 1949. This epic tells the tale of how the US Air Force airdropped food and supplies to stranded travelers, residents and liv",English,United States,Nothing,https://m.media-amazon.com/images/M/MV5BYmI4NmYyZTgtNzMwNy00MjEwLWE1NTUtNjJlNTVhNzdmMTkxXkEyXkFqcGdeQXVyMTQ3Njg3MQ@@._V1_SX300.jpg,"[{'Source': 'Internet Movie Database', 'Value': '5.4/10'}]",64.01811594,5.4,35785.50713,tt0042811,movie,N/A," $40,071,397.78 ",N/A,N/A,True,
522,Train to Tombstone,1950,Passed,16-Sep-50,56 min,"Action, Adventure, Romance",William Berke,"Don 'Red' Barry, Orville H. Hampton, Victor West","Don 'Red' Barry, Robert Lowery, Wally Vernon","One of the passengers on a train to Tombstone decides to rob it of the  250,000 it is carrying.",English,United States,Nothing,https://m.media-amazon.com/images/M/MV5BZWQ4NGJkODItOGM3Ny00ZDY0LWE4MWYtNGZjZmZjMTQzYzA1XkEyXkFqcGdeQXVyNTM3MDMyMDQ@._V1_SX300.jpg,"[{'Source': 'Internet Movie Database', 'Value': '4.8/10'}]",64.01811594,4.8,35785.50713,tt0043064,movie,N/A," $40,071,397.78 ",N/A,N/A,True,
523,Bandit Queen,1994,Not Rated,30-Jun-95,119 min,"Biography, Crime, Drama",Shekhar Kapur,"Ranjit Kapoor, Mala Sen","Seema Biswas, Nirmal Pandey, Rajesh Vivek",The story of the bandit queen Phoolan Devi who was sent to prison in 1983 and got free in 1994.,"Hindi, Assamese",India,4 wins & 2 nominations,https://m.media-amazon.com/images/M/MV5BOThkN2U4ZTItYmQzYi00YzBlLWJjNzAtZjRkZjQ4ODc4OTk0XkEyXkFqcGdeQXVyMTMxMTY0OTQ@._V1_SX300.jpg,"[{'Source': 'Internet Movie Database', 'Value': '7.6/10'}, {'Source': 'Rotten Tomatoes', 'Value': '100%'}]",64.01811594,7.6,"35,786",tt0109206,movie,10-Jan-21,"$40,071,398 ",N/A,N/A,True,
524,F.B.I. Girl,1951,Approved,4-Nov-51,74 min,"Crime, Drama, Film-Noir",William Berke,"Dwight V. Babcock, Richard H. Landau, Rupert Hughes","Cesar Romero, George Brent, Audrey Totter","A governor planning to run for U.S. Senate has a secret past that could prove damaging to his political aspirations: he's a convicted murderer, and that will come to light if the FBI does an investigative check on him. He goes to a l",English,United States,Nothing,https://m.media-amazon.com/images/M/MV5BM2QzOTNkNDMtYzA5Yy00YjdhLThmMTEtODc5NWQ5NzY4MzJmXkEyXkFqcGdeQXVyMTQ3Njg3MQ@@._V1_SX300.jpg,"[{'Source': 'Internet Movie Database', 'Value': '6.1/10'}]",64.01811594,6.1,35785.50713,tt0043516,movie,28-Nov-11," $40,071,397.78 ",N/A,N/A,True,
525,In the Jungle: The making of Cannibal Holocaust,2003,R,22-Jun-03,58 min,Documentary,Michéle De Angelis,Michéle De Angelis,"Ruggero Deodato, Luca Barbareschi, Sergio D'Offizi",N/A,Italian,Italy,Nothing,https://m.media-amazon.com/images/M/MV5BZDYwNWIwMDktYmY1Ny00NzNhLWFjZDctMmFhY2FmN2MyNTQxXkEyXkFqcGdeQXVyMTI3NTgzMDA4._V1_SX300.jpg,"[{'Source': 'Internet Movie Database', 'Value': '5.1/10'}]",64.01811594,5.1,35785.50713,tt2203815,movie,N/A," $40,071,397.78 ",N/A,N/A,True,
526,Cop Hater,1958,Not Rated,1-Oct-58,75 min,"Crime, Drama, Film-Noir",William Berke,"Evan Hunter, Henry Kane","Robert Loggia, Gerald S. O'Loughlin, Ellen Parker",The hardworking detectives of the 87th Precinct in an unnamed city during a massive heat wave investigate the seemingly random murders of policemen.,English,United States,Nothing,https://m.media-amazon.com/images/M/MV5BMWRjYWEwNWQtOGNhMS00ZjUyLTgxMTQtZjhjZTg3NGI0ZmY0XkEyXkFqcGdeQXVyMjI4MjA5MzA@._V1_SX300.jpg,"[{'Source': 'Internet Movie Database', 'Value': '6.4/10'}]",64.01811594,6.4,35785.50713,tt0051489,movie,1-Sep-16," $40,071,397.78 ",N/A,N/A,True,
527,Gold Diggers of 1935,1935,Approved,15-Mar-35,95 min,"Comedy, Musical",Busby Berkeley,"Manuel Seff, Peter Milne, Robert Lord","Dick Powell, Adolphe Menjou, Gloria Stuart","Romantic antics abound among the guests at a luxury hotel, including a stage director, an eccentric millionaire, and the daughter of a financial backer.",English,United States,Won 1 Oscar. 2 nominations total,https://m.media-amazon.com/images/M/MV5BM2IyNWVjOTItOGIzNi00ZDQ4LWEwYWMtN2Q3NWM3ZjlhNjllXkEyXkFqcGdeQXVyMzg1ODEwNQ@@._V1_SX300.jpg,"[{'Source': 'Internet Movie Database', 'Value': '6.9/10'}, {'Source': 'Rotten Tomatoes', 'Value': '100%'}]",64.01811594,6.9,"35,786",tt0026421,movie,25-Oct-05," $40,071,397.78 ",N/A,N/A,True,
528,Hollywood Hotel,1937,Approved,15-Jan-38,109 min,"Comedy, Musical, Romance",Busby Berkeley,"Jerry Wald, Maurice Leo, Richard Macaulay","Dick Powell, Rosemary Lane, Lola Lane","Ronny Bowers, a saxophonist in Benny Goodman's band, has won a talent contest and a ten week contract with a film studio. On his first evening he is supposed to go with the studio's star Mona Marshall to a movie premiere. But this la",English,United States,1 win,https://m.media-amazon.com/images/M/MV5BOWJmZDgwN2YtYmZlNi00YjM1LWE1MWMtZDY2MDY1MzdiNGI2XkEyXkFqcGdeQXVyMDI2NDg0NQ@@._V1_SX300.jpg,"[{'Source': 'Internet Movie Database', 'Value': '6.4/10'}]",64.01811594,6.4,35785.50713,tt0029010,movie,16-Sep-08," $40,071,397.78 ",Warner Brothers/Seven Arts,N/A,True,
529,Men Are Such Fools,1938,Approved,16-Jul-38,69 min,"Drama, Romance",Busby Berkeley,"Norman Reilly Raine, Horace Jackson, Faith Baldwin","Wayne Morris, Priscilla Lane, Humphrey Bogart","Linda Lawrence rises from secretary to account executive in an advertising agency. She falls in love with ex-football star Jimmy Hall and marries him. Radio man Harry Galleon will push her career further if she will just be ""nice"" to","English, Cantonese",United States,Nothing,https://m.media-amazon.com/images/M/MV5BZDQwYmQ4ZTctYjliYi00MGZiLWEzY2ItMjE4M2RiNzhkMzhkL2ltYWdlL2ltYWdlXkEyXkFqcGdeQXVyMDI2NDg0NQ@@._V1_SX300.jpg,"[{'Source': 'Internet Movie Database', 'Value': '5.4/10'}]",64.01811594,5.4,35785.50713,tt0030433,movie,20-Oct-16," $40,071,397.78 ",Warner Brothers/Seven Arts,N/A,True,
530,Babes in Arms,1939,Unrated,13-Oct-39,94 min,"Comedy, Musical",Busby Berkeley,"Jack McGowan, Kay Van Riper, Richard Rodgers","Mickey Rooney, Judy Garland, Charles Winninger","A group of vaudevillians struggling to compete with talkies hits the road hoping for a comeback. Frustrated to be left behind, all of their kids put on a show themselves to raise money for the families and to prove they've got talent",English,United States,Nominated for 2 Oscars. 2 nominations total,https://m.media-amazon.com/images/M/MV5BMTQ1MzUwNjkxOV5BMl5BanBnXkFtZTgwNzk3NTQ2MzE@._V1_SX300.jpg,"[{'Source': 'Internet Movie Database', 'Value': '6.4/10'}, {'Source': 'Rotten Tomatoes', 'Value': '90%'}]",64.01811594,6.4,"35,786",tt0031066,movie,25-Sep-07," $40,071,397.78 ",Metro Goldwyn Mayer,N/A,True,
531,They Made Me a Criminal,1939,Approved,28-Jan-39,92 min,"Crime, Drama, Film-Noir",Busby Berkeley,"Sig Herzig, Bertram Millhauser, Beulah Marie Dix","John Garfield, Claude Rains, The Dead End Kids",A boxer flees believing he has comitted a murder while he was drunk.,English,United States,Nothing,https://m.media-amazon.com/images/M/MV5BZjIwZGQ3OWItMzBlOC00NzQ4LTlmYzUtYjc2NTdhYjk5MTJkXkEyXkFqcGdeQXVyMTMxMTY0OTQ@._V1_SX300.jpg,"[{'Source': 'Internet Movie Database', 'Value': '6.9/10'}]",64.01811594,6.9,"35,786",tt0032022,movie,26-Nov-02," $40,071,397.78 ",N/A,N/A,True,
532,Strike Up the Band,1940,Passed,27-Sep-40,120 min,"Comedy, Musical, Romance",Busby Berkeley,"John Monks Jr., Fred F. Finklehoffe, Herbert Fields","Mickey Rooney, Judy Garland, Paul Whiteman and Orchestra","A high school boy wants to become a professional musician, and his gal pal wants to become his best girl. They work together staging big band shows with fellow classmates in the hopes of hitting it big.",English,United States,Won 1 Oscar. 1 win & 2 nominations total,https://m.media-amazon.com/images/M/MV5BMzQ4YmY0YjctODkyOS00OGEzLTgyZjYtYjU4ZTU1MjlkMDhmXkEyXkFqcGdeQXVyNTE4MzAyNDk@._V1_SX300.jpg,"[{'Source': 'Internet Movie Database', 'Value': '6.9/10'}, {'Source': 'Metacritic', 'Value': '59/100'}]",59,6.9,"35,786",tt0033110,movie,25-Sep-07," $40,071,397.78 ",N/A,N/A,True,
